제목,날짜,분류,기자,본문
"北 통신, 보건의료 분과회담 보도 “공동보도문 채택”",2018-11-08 08:01,정치,,북한 관영 조선중앙통신은 지난 7일 개성 남북 공동연락사무소에서 열린 남북 보건의료 분과회담 관련 소식을 하루가 지난 8일 보도했다.통신은 “역사적인 ‘9월 평양공동선언’ 이행을 위한 북남 고위급 회담 합의에 따라 보건의료 분과회담이 북남 공동 연락사무소에서 진행됐다”라며 “쌍방은 전염성 질병의 류입과 확산을 막기 위한 방역 및 보건의료 협력을 추진해나가는데서 제기되는 대책적 문제들을 협의하고 공동보도문을 채택했다”라고 전했다.통신은 다만 공동보도문의 구체적인 내용은 언급하지 않았다.앞서 남북은 전날 열린 회담에서 내년 중 감염병 유입과 확산 방지를 위해 상호 정보를 교환하는 시범사업을 진행하기로 합의했다.또 연락사무소를 통해 정례적으로 만나 감염병 공동대응과 보건의료 협력 방안을 협의키로 했다. 이를 통해 향후 중장기적 남북 보건의료 협력 방안을 논의키로 했다.    남북이 보건의료 분과회담을 연 것은 2007년 12월 남북 보건의료·환경보호협력 분과위원회 이후 11년 만이다.(서울=뉴스1)    
[연예뉴스 HOT5] 안민석 “내년 방탄소년단 평양 공연 추진”,2018-11-08 06:57,연예,스포츠동아,국회 문화체육관광위원회 안민석 위원장(더불어민주당)이 그룹 방탄소년단의 내년 평양 공연을 추진하겠다고 밝혀 실현 여부에 관심이 모아진다.안 위원장은 7일 KBS1 라디오 ‘정준희의 최강시사’에 출연해 “남북 문화체육협력특위에서 내년쯤 방탄소년단의 평양 공연을 추진하려 한다”고 말했다.그 가능성에 대해 안 위원장은 “모든 길을 만들어 가야 한다. 이런 문화예술체육관광 교류는 관계국의 눈치를 보지 않고 우리 남북이 민족 간에 협력만 하면 가능한 일”이라며 “제재가 풀리기까지 남북이 힘을 모아 문화체육예술관광 교류를 해야 하는 것이 민족적인 과제”라고 강조했다.[스포츠동아 엔터테인먼트부]        
‘성공한 딸’ 김한별의 소원 “엄마와 백두산 가고 싶어요”,2018-11-08 05:30,스포츠,정지욱,"지금은 화합과 통합의 시대다. 국제결혼을 통해 이뤄진 다문화가족은 어엿한 우리 사회의 일부이자 함께 할 구성원이다. 이는 스포츠도 예외는 아니다. 종목을 불문하고 다문화 가족 출신 선수를 흔히 찾아볼 수 있다. 스포츠동아는 국민체육진흥공단이 발행하는 체육진흥투표권 스포츠토토 수탁사업자 케이토토와 함께 다문화가족 출신으로 스포츠를 통해 자신의 꿈을 실현해 나가는 선수들과 이들을 지원하는 여러 체육인들을 소개하고자 한다. 이 사회의 한 축을 이루고 있는 다문화가족 어린이와 청소년, 부모들의 꿈과 용기를 응원하고자 기획 시리즈를 마련했다.다문화가족이 꾸준히 증가하고 있다. 우리나라 신생아 20명 중 1명은 다문화가정에서 태어나고 있으며 다문화가족 수도 100만명에 이른다. 이제 더불어 사는 우리 사회에서 흔하게 볼 수 있는 모습이다.스포츠 분야도 마찬가지다. 다문화가정에서 태어난 선수들이 무대를 주름잡는 시대다. 특히 농구는 일찌감치 혼혈 선수들의 유입을 받아들였다. 여자프로농구 삼성생명의 김한별(32)은 대표적인 다문화가족 선수다.김한별은 한국인 어머니와 흑인 아버지 사이에서 태어났다. 여동생(김한빛)도 있다. 7살 때 부모의 이혼으로 어머니의 손에서 자랐다. 3년 뒤 김성자 씨가 토니 패스워터(64) 씨와 재혼하면서 현재에 이르고 있다. 김한별의 친 아버지는 2011년 세상을 떠났다.김성자 씨는 “피닉스에서 살다가 (김)한별이가 7살 때 인디애나로 이사를 갔다. 엄마가 아시안이니까 학교에서 ‘차이니즈’라며 놀림을 당했다고 나중에 커서 말해주더라. 그 당시에는 그런 말을 전혀 안했다”고 돌아봤다. “어릴 때부터 속이 깊고 점잖은 편이었다. 운동도 잘하고 공부도 늘 1등이었다”며 어린시절을 회상했다.김한별은 어렸을 때부터 운동신경이 남달랐다. 또래보다 체격도 크고 운동도 잘하는 편이었다. 김한별은 “같은 나이 대 애들 중에서는 내가 체격이 큰 편이었고 달리기도 제일 빨랐다. 그래서 애들이 날 건들지 못했다”며 “그 와중에도 엄마가 아시안이라고 놀리는 애들이 있기는 했는데, 내가 참는 것 말고는 할 수 없지 않나. 크게 신경 쓰지는 않았다”고 말했다.현재 부친은 친아버지는 아니었지만, 김한별을 누구보다 아꼈다. 특히 딸의 교육에 공을 들였다. 인디애나 지역에서 가장 좋은 사립 중·고등학교로 진학을 시킬 정도였다. 김성자 씨는 “남편이 나보다 딸을 더 아끼는 것 같다”며 웃었다.어머니는 딸을 운동선수로 키우고 싶지 않았다. 공부도 잘했기 때문에 의사가 되길 바랐다. 그러나 농구선수로의 재능이 워낙 뛰어났다. 농구 명문 인디애나 대학교에 진학해 프로농구 선수의 길로 접어들었다. 김한별은 “대학 다닐 때 하루는 에이전트를 통해 한국의 삼성생명에서 나에게 입단 제의를 했다는 이야기를 들었다. 너무 기분 좋았다”며 “쉬운 결정은 아니었지만, 엄마의 나라에서 가족들을 만나고 한국 생활을 경험하고 싶었다”고 말했다.김성자 씨는 “처음에는 나한테 ‘엄마, 딱 2년만 프로로 뛸게’라고 말하더라. 한별이가 농구를 너무 좋아해서 그러라고 했는데 그 때는 지금까지 뛰고 있게 될 줄은 꿈에도 몰랐다”며 웃었다.김한별은 지난해 국가대표가 돼 태극마트도 달았다. 말 그대로 ‘가문의 영광’이었다. 올해에는 2018 자카르타-팔렘방 아시안게임에 출전했고, 남북 통일농구대회에 출전하기 위해 북한 평양을 다녀오는 특별한 경험도 했다.김한별은 “솔직히 국가대표가 될 줄 몰랐다. 국적을 획득했지만, 앰버 해리스(28)의 귀화를 추진하기도 했고 첼시 리(27) 사건도 맞물려서 내게는 기회가 안 올 줄 알았다”고 말했다.특히 평양 방문은 가족들에게 자랑할만한 이야기였다. 김한별은 “엄마도 좋아했지만 삼촌, 이모들이 더 좋아하더라. ‘미국에서 자란 조카가 농구해서 국가대표가 되고 북한까지 다녀왔다’며 반겼다. 북한은 미국 켄터키 같은 분위기였다”고 돌아봤다. “평양에 미국 국무장관(마이크 폼페이오)이 방문을 해서 에어포스 원을 볼 수 있었다. 가까이서 본 건 처음이었는데 엄청나게 크더라”며 평양에서의 기억을 되새겼다.그녀는 “카메라가 와서 어쩔 수 없었다(웃음). 냉면을 잘 안 먹어봐서 옥류관 냉면이 맛이 어떤지 잘 몰랐다. 그런데 먹기 괜찮더라”라며 웃었다.여자농구대표팀은 이번 AG에서 남북 단일팀을 이뤄 나갔다. 이 역시 김한별에게는 잊을 수 없는 추억이었다. 북한 선수 중 로숙영은 ‘한별이 언니를 가방에 담아서 북한에 데려갔으면 좋겠다’는 농담을 할 정도로 유독 자신을 따랐다고 전했다.김성자 씨는 국가대표 이야기를 하는 딸의 모습을 보며 마냥 흐뭇해했다. “한별이가 자랑스럽다. 나는 근처에도 못 간 북한을 우리 딸이 다녀오고 북한 선수들과 생활도 하지 않았나”라며 딸을 바라봤다.이에 김한별은 “엄마 세대 분들은 언젠가 북한 방문 길이 열리면 가보고 싶다고들 하시더라. 통일이 되면 엄마랑 같이 백두산에 다녀오고 싶다”면서 모친의 손을 꼭 잡았다.용인｜정지욱 기자 stop@donga.com  김한별은 여자프로농구 무대에서 파워 넘치는 플레이를 즐기는 선수다. 신장은 178㎝로 크지 않은 편이지만, 힘과 투지는 누구에게도 지지 않는다. 이처럼 코트 위에서는 강한 위력을 발휘하는 그녀지만, 모친 김성자(63) 씨 앞에서는 애교 많고 사랑스러운 큰 딸의 모습뿐이다. 누구보다 끈끈한 애정으로 똘똘 뭉쳐 있는 김한별-김성자 모녀를 가을이 무르익은 용인 삼성트레이닝센터에서 만났다.       농구는 우연한 기회에 시작하게 됐다. 김한별은 “운동을 간 동생을 기다리다가 옆 체육관에서 농구하는 걸 구경하다가 흥미를 가지게 됐다”고 말했다. 어머니 김 씨는 “얘가 하루는 수영을 안 하고 체육관 가서 농구를 보겠다고 하더라. 그 후로는 자주 체육관을 갔다. 하루는 뒤따라가서 보니까 큰 남자들 사이에서 공을 튕기면서 놀고 있더라. 그 때 ‘아, 얘가 농구가 좋구나’하고 생각했다”고 설명했다.    에피소드도 있었다. 당시 방북단은 옥류관에서 평양냉면을 먹었는데, 이 때 카메라가 김한별을 향하자 이에 엄지손가락을 치켜세우기도 했다. 사실 김한별은 냉면을 잘 먹지 않는다.     "
[전합니다]한국실학학회 外,2018-11-08 03:00,사람속으로,,"(회장 하우봉)는 10일 서울 성북구 고려대 민족문화연구원에서 동계학술대회를 연다. 윤사순 고려대 명예교수가 ‘신실학의 의미와 구성 방향’을 주제로 기조발표를 한다. (회장 김재실)는 8, 9일 서울 강남구 도산기념관에서 ‘안창호 선생 탄신 140주년 기념행사’를 개최한다. 대표 양원태)은 장애인 당사자 단체들과 공동으로 8일 오전 10시 서울 영등포구 이룸센터에서 ‘2018 장애정책박람회’를 개최한다. (회장 김명자)(위원장 이현구)는 9일 오후 2시 서울 강남구 한국과학기술회관 소회의실2에서 남북과학기술 교류협력 포럼(주제 ‘한반도 공동번영을 위한 남북과학기술 협력’)을 개최한다. (회장 유한규 한양대 교수)는 8일 오후 1시 반 서울 강남구 건설회관 2층 중회의실에서 ‘2018 KTA 정책포럼’(주제 ‘지하안전특별법 시행에 따른 터널에서의 지하안전관리방안 모색’)을 연다. (회장 김영윤)과 농업·농촌의길2018조직위원회(위원장 이정환)는 14일 오전 9시 서울 서초구 엘타워 그레이스홀에서 심포지엄(주제 ‘격동하는 국내외 정세와 농업·농촌의 길’)을 개최한다.    "
강화 화도면 농업진흥구역 경제자유구역 지정 추진,2018-11-08 03:00,사회,차준호,"인천경제자유구역청은 강화군 화도면 농업진흥구역(907만5000m²)을 경제자유구역으로 지정하는 방안을 추진한다고 7일 밝혔다. 해외자본 유치를 통해 남북 협력이 가능한 첨단산업, 물류, 관광레저단지를 유치하기 위해서다.  이곳에 자본을 투입할 외국인투자기업인 ‘강화시티글로벌파트너스’는 영종∼강화를 잇는 14.6km(4차로)의 교량(총 공사비 6700억 원)을 건설해 인천경제청에 기부채납하는 조건을 제시했다. 또 위락시설을 조성할 수 있는 관광시설용지 114만1800m²를 개발하기로 했다. 나머지 토지에는 첨단산업단지와 물류, 관광레저시설을 조성해 사업비를 충당한다.  교량 건설을 국비 등으로 충당하려고 했지만 강화 남단 경제자유구역 사업이 자칫 더디게 진행될 수 있다는 우려가 나와 민간투자를 검토하고 있다. 강화시티글로벌파트너스는 총 사업비 2조4000억 원을 투자해 첨단산업단지와 연간 수백만 명의 관광객이 찾는 리조트를 만들 계획이다. 참성단과 고려궁지, 고고학 유적지, 청동기 유적지와 동막해수욕장을 연계한 관광레저단지를 개발하게 된다. 인천시는 서해평화시대에 맞춰 남북경협의 핵심 인프라인 영종∼강화 연도교 건설의 기본계획 용역 조사를 벌인다. 차준호 기자 run-juno@donga.com     "
北-美회담 하루전 취소… 또 꼬이는 비핵화 협상,2018-11-08 03:00,국제,이정은,"미국 뉴욕에서 8일(현지 시간) 열릴 예정이었던 마이크 폼페이오 미 국무장관과 김영철 북한 통일전선부장 간 회담이 개최 하루 전 돌연 취소됐다. 북핵 협상의 돌파구가 될 것으로 기대를 모았던 북-미 고위급 회담이 전격 무산되면서 비핵화 논의 교착 국면이 장기화될 것이라는 우려가 커지고 있다. 김정은 북한 국무위원장의 연내 답방을 비롯한 남북관계 관련 일정에도 악영향이 불가피해 보인다. 미 국무부는 7일 헤더 나워트 대변인 명의의 성명을 내고 “이번 주 뉴욕에서 열릴 예정이었던 폼페이오 장관과 북한 관료들의 회담은 나중에(at a later date) 열기로 했다”며 취소 사실을 공식 확인했다. 앞서 뉴욕행 비행기로 갈아타기 위해 이날 오전까지는 중국 베이징 서우두 공항에 도착할 것으로 예상됐던 김영철은 끝까지 모습을 드러내지 않았다. 국무부는 성명에서 “서로의 일정이 허락될 때 회담을 다시 잡을(reconvene) 예정이며, 대화도 계속 진행 중”이라며 “미국은 도널드 트럼프 대통령과 김정은 북한 국무위원장이 6월 싱가포르 정상회담에서 합의한 약속을 이행해 나갈 것”이라고 덧붙였다. 회담 취소 이유는 언급하지 않았다. 국무부는 불과 이틀 전 성명을 내고 북-미 고위급 회담의 일시와 장소를 공식 발표했다. 이 때문에 북측이 먼저 회담 취소를 요청했거나 일방적으로 통보한 것으로 보인다. 비핵화 조치에 따른 상응조치로 대북제재 완화 등을 요구했다가 접점을 찾지 못하자 이번 회담에서 기대할 게 없다고 판단했을 수 있다는 것. 북한은 최근 폼페이오 장관이 언론 인터뷰에서 잇달아 검증을 강조하며 ‘선(先)비핵화 후(後)상응조치’ 방침을 천명하자 “핵개발 ‘병진 노선’으로 복귀할 수 있다”며 반발했다. 미국으로부터 회담 취소 발표 몇 시간 전에 이를 통보받은 청와대는 당혹감을 감추지 못하면서도 비핵화 동력이 꺼지지 않도록 상황 관리에 나서고 있다. 김의겸 청와대 대변인은 국무부 발표 후 브리핑에서 “회담이 연기됐다고 해서 북-미 회담의 동력이 상실되는 방향은 아니라고 생각한다”고 말했다. 그러나 북-미가 연내에 다시 회담 일정을 잡을 가능성은 그리 높지 않아 보인다. 여기에 미국 중간선거에서 8년 만에 하원을 장악한 민주당이 트럼프 행정부의 대북 정책을 견제할 경우 비핵화 협상이 더 지연될 수 있다는 게 워싱턴 외교가의 대체적인 전망이다.이정은 lightee@donga.com·한상준 기자           "
[김갑식의 뫔길]대통령의 종교,2018-11-08 03:00,오피니언,김갑식,"문재인 대통령은 가장 소중한 애장품으로 묵주반지를 꼽을 정도로 독실한 가톨릭(천주교) 신자다. 20여 년 전 어머니가 선물한 이 묵주반지를 보면서 어려움이 있을 때마다 마음을 다잡는다고 한다.  1953년 경남 거제에서 태어난 문 대통령은 6·25전쟁 피란민들의 판잣집 촌에서 가난한 유년 시절을 보냈다. 초등학교 1, 2학년 때 학교를 마치면 인근 성당에 가 양동이를 들고 줄을 서서 구호식량을 배급받아 오는 게 장남의 일이었다. 자서전 ‘운명’에는 수녀복을 입고 식량을 나눠주던 수녀들의 모습이 천사 같았다는 내용도 있다. 어머니가 먼저 신자가 됐고, 문 대통령은 초등학교 3학년 때 부산 신선성당에서 세례를 받았다. 세례명은 티모테오, ‘하느님을 공경하는 이’라는 뜻이다. 대통령의 어머니는 지금도 이 성당에 다니고 있고, 문 대통령의 혼인성사(결혼식)도 이곳에서 치러졌다. 김정숙 여사도 ‘골롬바’(평화의 상징 비둘기)라는 세례명을 갖고 있다.  가톨릭 신자이면서도 이웃 종교에 대한 문 대통령의 관심은 남다르다. 5월 강원 속초 신흥사의 최고 어른인 조실(祖室) 오현 스님이 입적하자 소셜네트워크서비스(SNS)를 통해 “스님의 입적 소식에 ‘아뿔싸!’ 탄식이 절로 나왔다”라며 과거 인연을 회고했다. 7월에는 여름 휴가 직전 휴일을 이용해 유네스코 세계유산인 경북 안동 봉정사를 찾았다. 대통령이 사법시험 공부를 한 전남 해남 대흥사 동국선원 7번 방은 명소가 됐다. 문 대통령은 그동안 이웃 종교들에 대해 대체로 열린 자세를 보여 왔다는 게 세평이다. 그럼에도 최근 문재인 정부와의 불통(不通)을 호소하는 종교계의 목소리가 커지고 있다. 아울러 가톨릭 독주와 이웃 종교 ‘푸대접’론까지 나오는 실정이다.  문 대통령은 10월 바티칸 성베드로 대성당에서 열린 한반도 평화를 위한 특별미사에 참석했다. 한반도 평화라는 의미가 있지만 대통령 내외가 참석한 바티칸 미사 장면을 종교방송도 아닌 지상파TV가 생중계한 것은 지나치다는 게 불교계 주장이다. “교황 ‘알현’을 마치고 나왔던 문 대통령이 밝은 표정이었다”는 청와대 언급에 대해서도 다종교 국가의 국민 정서와 시대적 상황을 감안할 때 부적절하다는 쓴소리도 나왔다. 9월 평양에서 열린 제3차 남북 정상회담은 종교계에 예상밖의 후유증을 남겼다. 7대 종단 연합체인 한국종교인평화회의(KCRP) 회장이자 한국천주교주교회의 의장인 김희중 대주교와 조계종 민족공동체추진본부장(민추본) 원택 스님, 한국기독교교회협의회(NCCK) 이홍정 총무, 원불교 한은숙 당시 교정원장이 종교계 특별수행원으로 참가했다. 평양선언을 통해 2019년 3·1운동 100주년 기념사업을 남북 공동으로 하자고 제안하면서 3·1운동에서 주도적 역할을 한 천도교가 방북단에서 배제됐다. 이 여파로 천도교 내에서는 집행부 총사퇴론까지 나왔다. KCRP 소속이면서도 역시 방북단에서 빠진 유교와 한국민족종교협의회도 천도교와 마찬가지로 선정 기준을 이해할 수 없다는 반응이다.  방북 기간 중 가톨릭 측만 유일하게 북측 관계자와 접촉한 사실도 뒤늦게 알려져 특정 종교 특혜 논란도 있다. 원택 스님은 북측과 논의할 의제 등을 준비했고 정부에 여러 차례 그 뜻을 전달했지만 정상회담 성공에 집중해 달라고 해서 개별 만남과 협의는 이뤄지지 못했다는 게 민추본의 설명이다.  그러나 정부 요청과 달리 김 대주교는 방북 뒤 열린 간담회에서 “조선카톨릭교협회 강지영 회장과 조속한 시일 내에 만나 (사제 파견 등을) 협의하기로 합의했다”고 밝혔다.  종교계 현장에서 느끼는 정부와의 불통은 심각한 수준이다. 천도교 측은 방북단에서 배제된 뒤 임종석 대통령비서실장 앞으로 항의 공문을 보냈지만 아무런 답변을 듣지 못했다고 했다. 그 대신 “위에서 내려온 결정이라 사정을 모르겠다”(문화체육관광부) “미안하다. 다음에는 꼭 기회를 만들겠다”(대통령시민사회수석실)는 반응이 돌아왔을 뿐이다. 천도교의 한 고위 관계자는 “3·1운동 100주년 기념사업을 평양 공동선언에 넣으면서 천도교를 배제한 것은 청와대 참모진의 상식을 의심할 수밖에 없다”며 “힘센 종단만 초청한 것이냐? 정부가 오히려 종교 간 갈등을 부추기고 있다”고 했다. 보수적 성향의 개신교계에서도 현 정부와의 소통지수가 김대중 정부 이래 최악이라는 말까지 나오고 있다. 어떤 현안에 대해 입장을 내도 대체로 무반응이고, 필요할 때만 협조를 구한다는 것이다. 한 중견 목회자는 “문재인 정부의 종교관이 ‘종교는 마약’이라는 수준 아닌지 의심스럽다”고 했다. 남북 관계가 중시된다고 해도 특정 종교에 의지한 정책과 소통은 곤란하다. 대통령의 종교가 가톨릭이기에 더욱 종교 간 균형과 배려가 필요하다.김갑식 문화전문기자 겸 논설위원 dunanworld@donga.com             "
"[단독] 국회 사무처 “판문점선언 비준안, 요건 미달”",2018-11-07 22:45,정치,최고야기자,"국회 외교통일위원회가 정부의 판문점선언 비준동의안이 국회의 비준동의 대상 요건을 갖추지 못했다는 검토 의견을 냈다. 국회가 비준동의하기 위해 판단 근거로 삼아야 할 비용 추계를 정부가 내년도 1년치 자료로 갈음한 것은 문제가 있으며 비준동의를 얻으려면 세부내역을 내라는 것이다. 국회 외통위 소속 전문위원으로 하여금 6일 작성한 ‘한반도의 평화와 번영, 통일을 위한 판문점 선언 비준동의안 검토보고서’는 “정부가 제출한 비용 추계서는 2019년 1년에 한하는 비용추계만 있고, 사업별 세부 산출내역도 없어 사업 타당성 여부와 재정 추계의 적절성 분석에 한계가 있다”고 지적했다. 또 “활용 가능한 자료와 정보를 최대한 구체화해 국회에 비용추계서를 제출해야 한다”고 덧붙였다. 남북경협사업에 대해 정부가 구체적 비용 추계를 내지 못하면 판문점선언이 국회 비준동의 대상이 될 수 없다고 본 것이다. 국회 상임위 별 전문위원 검토보고서는 여야를 떠나 의원들이 법안 등 각종 의안을 심의·의결하기 전 적절성을 판단하기 위한 1차 자료로 활용된다.  국회 외통위는 또 검토보고서에서 남북 철도·도로 연결사업 예산 편성의 구체성과 타당성도 문제 삼았다. 앞서 정부는 비용 추계서에서 판문점선언 이행을 위한 내년도 예산으로 4712억 원을 잡았다. 이 중 남북 철도·도로 연결 및 현대화를 위한 무상 및 융자사업 예산은 각각 1864억 원과 1087억 원으로 전체 예산의 절반이 넘는다. 보고서는 “그동안 철도·도로 자재 등으로 북한에 9억3200만 달러의 차관을 제공했으나 회수 실적은 저조하다”고 지적했다. 또 국가재정법(제38조 2항)에 따라 남북교류협력 사업은 예비타당성 조사 대상에서 제외된다는 점을 지적하며 “사업 착공 이후 총 사업비 변경에 따른 재정부담 증가는 국민 부담으로 이어질 것”이라고 밝혔다. 최고야 기자 best@donga.com     "
