제목,날짜,분류,기자,본문
Kim Jong-un emphasizes future of North Korea-China relations after joint arts performance,2018-11-05 16:40,North Korea,Park Min-hee,"After watching a combined performance by artists from China and North Korea at the Mansudae Art Theatre in Pyongyang on Nov. 3, North Korean leader Kim Jong-un declared that “the traditional amity between North Korea and China, which has overcome the numerous storms of history, will flourish and develop even more moving forward, and we have been made certain of its bright future,” according to reports in the Rodong Sinmun and Korean Central News Agency (KCNA) on Nov. 4.

“The performance I saw was overflowing with the warmth and affection of the people of China and North Korea,” Kim said, while expressing “gratitude from the bottom of my heart” to Chinese President Xi Jinping for arranging the visit by the Chinese artists.

North Korea’s Foreign Ministry held a welcome banquet for the visiting Chinese artists at the Koryo Hotel Pyongyang on Nov. 2, and Kim Jong-un attended the combined performance on Nov. 3. Kim was accompanied at the performance by Choe Ryong-hae and Ri Su-yong, both vice chairmen of the Workers’ Party of Korea; Kim Yo-jong, deputy director of the party’s central committee; and Culture Minister Pak Chun-nam.

At the site of the performance, Kim was greeted by Luo Shugang, China’s Minister of Culture and Tourism and the head of the group of musicians; Wang Yajun, Vice Minister of the Communist Party of China’s International Department; and Li Jinjun, Chinese ambassador to North Korea.

As interest surrounds the possibility of Chinese President Xi Jinping visiting North Korea before the end of the year, Kim’s message of friendship to China regarding the formation of an amicable relationship between the two countries is attracting attention. The schedule of Xi’s visit to North Korea is likely to depend on the results of the working-level and high-level negotiations between North Korea and the US that are resuming next week and Xi’s first summit with US President Donald Trump since the beginning of the trade war began between China and the US.

Kim said that “The visit to Pyongyang by famous Chinese artists, who brought with them the warmth of friendship, has brought great joy to our people,” and Luo Shugang expressed his gratitude for the generous hospitality offered by the North Koreans. Kim expressed his hope that the Chinese artists’ visit to Pyongyang would be “a meaningful opportunity to further develop friendship between China and North Korea” and took a commemorative photo with the Chinese artists.

During the performance, popular songs in North Korea and China were performed on stage, and the event concluded with a choir singing, “May Chinese and North Korean friendship last forever.” Following the performance, Kim came on stage and shook hands with each of the Chinese artists to congratulate them on a job well done.

China’s state-run Xinhua News reported that Kim Jong-un had attended the first joint performance by Chinese and North Korean artists and that, before the show, he had met some of the major members of the troupe of artists and taken commemorative photos with them.

Xinhua News also said that Kim had highly praised the healthy and stable development of China-North Korea bilateral relations and expressed his gratitude to Xi Jinping and the leadership of the Communist Party of China for sending Chinese artists that are beloved by the North Korean people to Pyongyang to hold a performance celebrating friendship and exchange.

By Park Min-hee, staff reporter

Please direct comments or questions to [english@hani.co.kr]"
South and North Korea begin trial dismantlement of guard posts surrounding DMZ,2018-11-05 16:38,North Korea,Park Min-hee,"On Nov. 4, South and North Korea hoisted yellow flags at 11 guard posts on each side of the demilitarized zone (DMZ), marking the beginning of an attempt to dismantle these guards posts on a trial basis. South and North Korea raised yellow flags that measured 4m wide and 3m tall on Sunday morning in order to clearly identify the guard posts that are being closed, South Korea’s Ministry of National Defense (MND) explained.

“The procedure to dismantle the guard posts on a trial basis began with the hoisting of the yellow flags. The flags were raised in order to increase transparency and mutual trust by enabling military officials from both sides to clearly observe and confirm progress toward dismantling the posts,” explained an MND official.

The two sides have discussed the procedure for the trial program of dismantling the guard posts using the military communication lines on the West Sea since Nov. 1.

“Moving forward, the South and North Korean military authorities will continue to work together to ensure that the removal of soldiers and equipment and demolition of the guard posts can be completed by the end of November and that the mutual verification process can also be completed by mid-December,” the MND said.

South and North Korea agreed to dismantle 11 guard posts on each side on a trial basis by the end of the year in the Comprehensive Military Agreement (CMA), which was signed on Sept. 19. Then during the 10th round of general-level military talks that were held at Panmunjom on Oct. 26, they agreed to completely dismantle the guard posts in question by the end of November.

By Park Min-hee, staff reporter

Please direct comments or questions to [english@hani.co.kr]"
[Photo] South and North begin joint hydrographic survey of waterways near mouth of Han River,2018-11-05 16:14,North Korea,,South and North Korea commenced a joint hydrographic survey of the mouth of the Han River (Imjin River) for joint usage of its waterways on Nov. 5. It was the first joint inspection of the area since 1953. The joint survey team comprises 10 people from each side and includes both military officials and waterway experts. The team gauged the waterways’ depth using sonar to determine whether they were at safe levels for passage via boat. The joint survey was part of an inter-Korean military agreement signed by both sides on Sept. 19 during the inter-Korean summit in Pyongyang. (Yonhap News)
High-level North Korea-US talks likely to be complemented by working-level representatives,2018-11-03 15:24,North Korea,Noh Ji-won,"The high-level North Korea-US talks that US Secretary of State Mike Pompeo confirmed will be held next week are likely to adopt a “2+2”format with representatives attending from working-level negotiations, a source reported.

Addressing the possibility that the North Korea-US following talks would follow a 2+2 format with senior- and working-level representatives meeting, a foreign affairs source familiar with the two sides’ negotiations told the Hankyoreh on Nov. 2 that “the US is indeed hoping for that, and there’s a pretty good likelihood that’s how it will actually happen.”

This means a strong chance that the high-level meeting between Pompeo and his North Korean counterpart – predicted to be Workers’ Party of Korea Vice Chairman and United Front Department Director Kim Yong-chol – will also be attended by the two sides’ officials in charge of working-level negotiations, namely US State Department Special Representative for North Korea Policy Stephen Biegun and North Korean Vice Foreign Minister Choe Son-hui.

Washington’s concept appeared based on the conclusion that combining the working-level and high-level talks rather than keeping them separated would be a more efficient approach amid the current lack of progress in working-level discussions. Another source familiar with activities in Washington said, “There is absolutely no need to separate the high-level and working-level talks.”

“Working-level matters can be discussed at high-level talks and vice versa. There isn’t any need for one of them to come first,” the source said.

If Pyongyang does agree to Washington’s idea, the high-level and working-level representatives are expected either to all meet together at the North Korea-US follow-up talks next week or to meet separately at different times.


North Korea’s response to the US idea was not confirmed.

“As far as I know, the North has not sent a definite reply yet,” a foreign affairs source said.

The format could also be restricted to high-level talks depending on the response from Pyongyang. But the prevailing view among observers is that North Korea has little cause for dragging things out longer when the representatives for the working-level talks have yet to even see North Korean leader Kim Jong-un’s face after his agreement to the negotiations.

After Pompeo’s meeting with Kim during a North Korean visit last month, the State Department issued an Oct. 7 press release saying Pompeo and Kim had “agreed to instruct their respective working-level teams to meet soon to intensify discussions on the key remaining issues to deliver on the Singapore Summit Joint Statement.”



Now seen as likely to adopt a 2+2 format, the follow-up talks are expected to focus on three main areas: North Korea’s concrete denuclearization process, reductions in sanctions and other corresponding measures from the US, and the schedule and agenda for a second North Korea-US summit. With Pompeo announcing that the two sides could “make a substantial breakthrough in taking down the nuclear threat from North Korea” in their next summit, many are watching to see whether concrete progress toward denuclearization negotiations can be achieved at the talks.

In terms of the denuclearization process, plans for US verification of the Punggye Village nuclear test site and Tongchang Village missile engine testing site are expected to be discussed. In an Oct. 31 interview with Laura Ingraham, Pompeo discussed the matter of a US inspection team visiting the facilities to check on the progress of denuclearization.

“It’s one of the things I’ll speak with my [North Korean] counterpart next week about,” he confirmed.



Issues surrounding sanctions against North Korea also appear likely to come up for discussion. On Nov. 1, the North’s Rodong Sinmun paper published an article quoting Kim Jong-un’s reference to “hostile forces [. . . ] foolishly rampaging with dastardly sanction machinations” ahead of the North Korea-US follow-up talks – essentially denouncing the sanctions by the US. In a radio appearance on Nov. 1, Pompeo clearly affirmed that the US is insisting on denuclearization and verification before the lifting of sanctions.

“The economic sanctions [against North Korea] will not be lifted until such time as we have had the capacity to verify that they have eliminated their nuclear program,” he said in an interview on the “Lars Larson Show.”

In another appearance on the “Mark Reardon Show,” Pompeo said, “[O]nce we’ve had the capacity, the opportunity to verify that this [denuclearization] has taken place, then and only then will the economic sanctions that have been put on North Korea be removed.”

The tug-of-war between the two sides over denuclearization measures and the removal of sanctions is seen as likely to continue in their follow-up talks.

Another key issue will be coordination of the schedule and agenda for the second North Korea-US summit, which Pompeo has said he hopes will happen early next year. The two sides are expected to narrow down the summit schedule and exchange specific ideas on the location.

In addition to the North Korea-US follow-up talks, a South Korea-US working group also appears set to begin full-scale operation. Lee Do-hoon, the South Korean Ministry of Foreign Affairs special representative for Korean Peninsula peace and security affairs, is expected to visit the US around the same time as the follow-up talks. Around this time, the two sides are expected to hold the first meeting of the working group after a final decision on its launch during an Oct. 28–29 South Korea visit by Biegun.

By Noh Ji-won, staff reporter, and Hwang Joon-bum, Washington correspondent

Please direct comments or questions to [english@hani.co.kr]"
Inter-Korean military information exchanges resume on illegal Chinese fishing boats near NLL,2018-11-03 15:21,North Korea,Yoo Kang-moon,"South and North Korean military authorities resumed information exchanges on Nov. 2 on third-party vessels illegally fishing in near the Northern Limit Line (NLL) area in the West (Yellow) Sea.

The resumption comes a decade after information exchanges based on inter-Korean general-level military talks in June 2004 were suspended in May 2008. The measure is another step toward preventing unintended armed clashes and establishing maritime peace and joint fishing zones in the West Sea NLL area as specified in the two sides’ Sept. 19 military agreement.

According to the South Korean Ministry of National Defense, South and North Korean military authorities exchanged information via their West Sea military communication line at 9 am that day on the current status of “illegally fishing third-country vessels” in the NLL area. The ministry explained that the measure would be “meaningful in terms of the suspension of land-, sea-, and air-based hostile activities and demilitarization of the Panmunjom Joint Security Area recently pursued by South and North Korean military authorities, as well as the establishment of peace on the Korean Peninsula.”

At general-level talks in June 2004, the two sides agreed to use the West Sea military communication line to exchange information on third-party boats illegally fishing around the NLL – the “third party” here essentially referring to China. Notifications regarding the number, position (latitude and longitude), and fishing times of Chinese boats were exchanged between the Navy’s 2nd Fleet Command at Pyeongtaek and North Korea’s West Sea Fleet Command at Nampo before the exchanges were suspended in May 2008.

By resuming their exchanges of information on Chinese boats illegally fishing around the NLL, the two sides stand to reduce the chances of an unintended clash between their militaries. The risk of a clash arose in the past due to the potential for warships on both sides to closely approach or unwittingly cross the NLL while cracking down on Chinese fishing boats. In July, the two sides resumed operation of a shared international merchant ship network to prevent unintended clashes in the West Sea and restored their military communication line for the West Sea region.

The measure is also expected to contribute to the future establishment of a maritime peace zone and inter-Korean joint fishing zone in the West Sea. With anywhere from 50 to 100 Chinese vessels descending on the waters near Baengnyeong and Yeonpyeong Islands during fishing season and clearing out the waters down to small fry, many have complained of the devastating effect this has had on the grounds. At their tenth general-level talks on Oct. 16, South and North Korea agreed to quickly establish a joint military committee to discuss establishing a maritime peace zone and joint fishing zone in the West Sea.

By Yoo Kang-moon, senior staff writer

Please direct comments or questions to [english@hani.co.kr]"
South and North Korea to integrate respective branches of taekwondo,2018-11-03 15:18,North Korea,Kim Dong-hoon,"The South and North Korean versions of the martial art known as taekwondo –which branched off from the same roots – will be integrated at last.

World Taekwondo (WT), which took shape in South Korea, and the International Taekwondo Federation (ITF), which developed in North Korea, signed an agreement for the growth and integration of taekwondo at the Yanggakdo International Hotel in Pyongyang on the morning of Nov. 2. The integration of the two organizations, if it takes place this year, would come 45 years after WT was established as the World Taekwondo Federation in 1973 to serve as an alternative to the ITF, which was founded in 1966.

The signing ceremony was attended by executive delegations from the two organizations, including WT President Choue Chung-won and ITF President Ri Yong-son. Choue had been in Pyongyang since Oct. 30 with a WT demonstration team at the invitation of the ITF. After the two organizations reached a general agreement during working-level negotiations the previous day, a cheerful mood prevailed during a 50-minute event on Friday that included the signing of the agreement and commemorative photos.



To begin with, the organizations agreed to set up a joint body to work toward the integration of taekwondo. The two sides are planning to decide on the name of the organization, its character and the content of its activity by this coming December.

The two organizations also agreed to engage in activities to promote the integration of taekwondo. They’re planning to push for joint demonstration performances in China, Russia, Switzerland, the US and Japan, including at the 2020 Tokyo Olympics. The joint body is slated to deliberate the establishment of a joint training center so that the combined demonstration performances can gradually lead to a unified demonstration team.

The WT and the ITF also agreed to hold joint international competitions on a trial basis that will be held under their respective playing rules. The two sides plan to recognize each other’s belt titles and judge licenses so that taekwondo athletes who belong to the two organizations can participate in international competitions hosted by both sides, including continental and global tournaments.



Whereas the South Korean WT has more of a focus on sports, the North Korean ITF emphasizes its traditional martial arts aspects. WT practitioners study basic moves, forms, sparring, breaking boards and self-defense, with WT sparring becoming an official Olympic event during the 2000 Sydney Olympics. The areas studied in the ITF are basic moves, forms, sparring, power breaking and special techniques. South Korean taekwondo athletes wear protective gear on the head and body, but North Korean taekwondo is more violent, with athletes landing punches to the face while wearing a mouthpiece, gloves and soft shoes without soles.

On Friday, the two organizations also decided to seriously discuss the idea of submitting a joint petition to UNESCO to register taekwondo as an intangible cultural heritage. They will also be holding working-level deliberations once a month at an agreed-upon location to ensure the continuing implementation of the agreements reached on Friday.

The ITF was founded in Seoul in 1966 by Choi Hong-hi, the first chairman of the Korea Taekwondo Association. Because of friction with the government of South Korean President Park Chung-hee, Choi sought asylum in Canada in 1972 and then established his version of taekwondo in North Korea during a visit to Pyongyang in 1979. In 1973, shortly after Choi left the country, Kim Un-yong, then a councilor at the South Korean embassy to the US, established the WT on the orders of the Park administration. The two organizations have been at odds for more than 40 years while competing to increase the number of their respective member countries.

On Friday, WT President Choue Chung-won pointed out that next year marked the 25th year since taekwondo was adopted as an official Olympic event during the 1994 meeting of the International Olympic Committee (IOC) in Paris and proposed that the two sides hold a joint performance to mark the occasion in Lausanne, Switzerland, where the IOC headquarters is located. ITF President Ri Yong-son gladly accepted the proposal and said he would definitely be there.

But the IFT did not accept a proposal by the WT to set up an ITF national association in Pyongyang to help North Korean athletes take part in the Olympics. Perhaps in reference to this proposal, Ri Yong-son commented that “if you gulp down water too fast, you can choke on it.”



In related news, South and North Korea convened a meeting of the sports subcommittee at the Inter-Korean Liaison Office in Kaesong on Friday, with their teams of negotiators headed by South Korean Second Vice Minister of the Ministry of Culture, Sports and Tourism Roh Tae-kang and North Korean Deputy Minister Ministry of Sports Won Kil-u. During the meeting, the two sides agreed to send a letter to the IOC expressing their desire to host the 2032 Summer Olympics together.

Furthermore, South and North Korea agreed in principle to send unified teams to international sporting events, including the 2020 Tokyo Olympics, and to deliberate this issue with the IOC and with international athletic organizations representing each event. Accordingly, they will be sending a combined team to the handball world championship that will be held in Germany and Denmark in January 2019.

By Kim Dong-hoon, staff reporter

Please direct comments or questions to [english@hani.co.kr]"
[Photo] South and North agree to submit joint bid to host 2032 Summer Olympics,2018-11-03 15:04,North Korea,,"South Korean Second Vice Minister of Culture, Sports and Tourism Roh Tae-kang and North Korean Deputy Minister Ministry of Sports Won Kil-u met at the inter-Korean joint liaison office in Kaesong to discuss sports cooperation. The two sides agreed to send a letter to the IOC regarding their joint bid to host the 2032 Summer Olympics. They also agreed to send unified teams to international sporting events such as the 2020 Tokyo Olympics, and to deliberate this issue with the IOC and with international athletic organizations representing each event. Accordingly, they will be sending a combined team to the handball world championship that will be held in Germany and Denmark in January 2019. (photo pool)"
Kim Jong-un targets sanctions in remarks quoted in N. Korea’s Rodong Sinmun,2018-11-02 17:43,North Korea,Lee Je-hun,"The battle of nerves between Pyongyang and Washington over the North Korea sanctions issue is heating up again as the two sides resume their dialogue, with high-level talks reportedly set to take place in the US next week to prepare for a second bilateral summit.

In stories on the front and second pages of its Nov. 1 edition, the Rodong Sinmun, the official newspaper of the Workers’ Party of Korea (WPK), quoted North Korean leader Kim Jong-un as saying during a visit to the Wonsan-Kalma coastal tourism area construction site that “hostile forces are foolishly rampaging with dastardly sanction machinations to block improvements and development in our people’s welfare and force us to change and submit.”

While Kim’s remarks were focused more on the “injustice” of the sanctions than on a call for their lifting, it is seen as unusual for him to mention the issue publicly ahead of the high-level talks with the US.

The reference to sanctions was not the first by Kim. In its Aug. 17 edition, the Rodong Sinmun quoted Kim as saying during another visit to the Wonsan-Kalma coastal tourism area site that the construction effort was part of an “intense confrontation with hostile forces who seek to suffocate our people with a forceful blockade of sanctions.”

During his August visit, Kim pushed the zone’s completion date back six months to “October 10 of next year” (the anniversary of the WPK’s establishment) from the Apr. 15 date (the Day of the Sun holiday, founding leader Kim Il-sung’s birthday) mentioned during his first visit in May. Analysts saw the measure as based on a determination that the lifting of sanctions by the US would happen later than initially planned.

Kim’s visit to the Wonsan coastal tourism area was his third this year. The Rodong Sinmun also reported on Oct. 30 that Kim had given on-the-spot guidance in Samjiyon County for a third time in 2018. The efforts were seen as intended to personally check on and encourage the four major construction projects emphasized in his New Year’s address.

During his visit to the Wonsan-Kalma coastal tourism area, Kim said the “country’s situation is difficult at the moment,” but added, “I can already see the day before long when [Wonsan’s Myongsasimni Beach] is crowded with people.”



Meanwhile, the US Treasury Department’s Financial Crimes Enforcement Network (FinCEN) issued a financial transaction advisory on Oct. 31 warning that North Korea presents a risk of laundering money and terrorism financing, Voice of America reported on Nov. 1. In its advisory, FinCEN said the OECD-affiliate Financial Action Task Force (FATF) had urged member countries to take response actions against North Korea to protect the international financial system from money laundering and terrorist financing risk factors.

It went on to provide a detailed four-page explanation including information on the major content of related UN Security Council resolutions and independent sanctions by the Treasury Department’s Office of Foreign Assets Control (OFAC) based on an executive order by the US President.

FinCEN previously issued an identical advisory on Oct. 21. With its renewed advisory, the Treasury Department appears to be a stronger signal that sanctions against North Korea are to be kept in place following FATF designating North Korea once again as a state requiring response measures.

By Lee Je-hun, senior staff writer, and Park Min-hee, staff reporter

Please direct comments or questions to [english@hani.co.kr]"
