제목,날짜,분류,기자,본문
Mine removal operation in Panmunjom’s JSA completed,2018-10-20 16:07,North Korea,Park Byong-su,"The operation to clear mines from the Joint Security Area (JSA) at Panmunjom has effectively been completed. Next week, the two sides are expected to begin removing troops from guard posts (GPs).

“The clearing of mines, which is the first step toward demilitarizing the JSA, has basically ended. We’re told that the North Koreans are also in the final stages,” a South Korean military official said on Oct. 19. In a military agreement reached last month, South and North Korea said they would remove all mines from the JSA by Oct. 20. During the mine removal work that has continued since Oct. 1, North Korea has apparently removed five mines, while South Korea has not turned up any mines.

Since the mine clearing operations have gone smoothly, South and North Korea, along with the UN Command, are planning to immediately begin removing GPs, troops and firearms from the JSA. According to the military agreement, which South and North Korea signed on Sept. 19, all the GPs, staff and firearms on both sides are supposed to be removed five days after the mines have been cleared.

North Korea currently has five GPs inside the JSA, while South Korea has four. After all the posts are gone, the two sides will set up alternating GPs at the northern and southern entrances to the JSA. South Koreans will install a GP at the end of Panmunjom Bridge, at the northern entrance, while North Koreans will install one at the southern entrance. All the weaponry in the possession of South and North Korean troops – including machine guns, AK-47 rifles, K-2 rifles and handguns – will be removed from the JSA.

In a press release issued on Friday, the UN Command said it had verified the mine removal work that had taken place thus far at Panmunjom as part of the Agreement on the Implementation of the Historic Panmunjom Declaration in the Military Domain (also called the Comprehensive Military Agreement, or CMA) in close cooperation with the South Korean Joint Chiefs of Staff and that it supported the next practical steps that South and North Korea would take to implement the military agreement.

“Yesterday's UN Command verification of initial mine clearance operations in the Demilitarized Zone (DMZ) lays the foundation for future progress on the CMA [Comprehensive Military Agreement] implementation,” said Gen. Vincent Brooks, commander of the UN Command.

Brooks added that the UN Command would deliberate closely with South and North Korea to work on implementing the other terms of the agreement.

By Park Byong-su, senior staff writer

Please direct comments or questions to [english@hani.co.kr]"
Moon asks ASEM member states for support to peace on Korean Peninsula,2018-10-20 16:05,North Korea,Seong Yeon-cheol,"South Korean President Moon Jae-in, who visited Belgium to attend the Asia-Europe Meeting (ASEM), said on Oct. 19 that “peace on the Korean Peninsula will lead to the co-prosperity of Asia and Europe” and asked ASEM member states to lend their support to peace on the Korean Peninsula.

“During my three meeting with North Korean leader Kim Jong-un, I have confirmed his commitment to denuclearization and to peace on the Korean Peninsula. North Korea and the US have also ended their 70-year hostile relationship and are sitting down together to discuss peace,” Moon said during general remarks in the ASEM summit, which was held in Brussels on Friday.

“South Korea is actively pursuing a New Southern Policy that aims to link ASEAN and India on the ocean and a New Northern Policy that seeks to create a continental connection to Europe. I believe that the link between Asia and Europe will be completed through peace on the Korean Peninsula,” Moon said. While emphasizing that peace on the Korean Peninsula, rather than being irrelevant to the ASEM member states, is linked to their joint development, Moon asked for their interest and support.

“We need to establish an open and predictable trade order and ensure that the foundation of the system of free trade is not undermined. While ASEM leads the discussion about the people-centered Fourth Industrial Revolution, we must not allow other forms of inequality to arise, such as the polarization of jobs or the widening of the digital divide,” Moon said during his speech.

In meetings with the leaders of the UK, Germany and the EU prior to the ASEM summit, Moon spoke of the need to ease the international community’s sanctions on the North as progress is made on the North’s denuclearization and took steps to promote public discussion of this idea.

During Moon’s summit with Prime Minister Theresa May of the UK (who has a say over lifting sanctions on North Korea as the head of government of a permanent member of the UN Security Council), Moon reportedly made his case for the international community easing sanctions on the North when real progress is made toward the North’s denuclearization. Moon expressed his willingness to seriously consider easing sanctions on the North even before its complete denuclearization during an interview with the BBC prior to his tour of Europe.

The South Korea-UK summit took place at Moon’s request. May said she would not waver in supporting peace on the Korean Peninsula. During summits with the leaders of France and Italy, Moon repeated his view that “once North Korea’s steps toward denuclearization are believed to have reached an irreversible state, UN sanctions should be relaxed to promote denuclearization.”

Afterward, Moon also had a summit with German Prime Minister Angela Merkel.

“The Berlin Initiative served as the beginning of the recent positive changes on the Korean Peninsula,” Moon said gratefully, referring to a speech in July 2017 during which he asked North Korea to participate in the Pyongyang Winter Olympics and expressed his willingness to hold a summit with North Korean leader Kim Jong-un.

“During this tour of Europe, Moon has been explaining in detail the changing mood on the Korean Peninsula and asking the states of Europe for their understanding and cooperation,” said a senior official at the Blue House. Moon called for protection of the multilateral trade order, inclusive growth and a joint response to climate change and protection of the environment.

By Seong Yeon-cheol,, staff reporter

Please direct comments or questions to [english@hani.co.kr]"
Moon says giving speech at St. Peter’s Basilica was “like a dream”,2018-10-19 14:52,North Korea,Seong Yeon-cheol,"“Panmunjom will now become a symbol of peace on the Korean Peninsula,” said South Korean President Moon Jae-in during his official visit to the Vatican on Oct. 17. Moon said it felt “like a dream” to deliver a speech in St. Peter’s Basilica.

After completing a “special mass for peace on the Korean Peninsula” at St. Peter’s Basilica in the Vatican City on Wednesday, Moon had dinner at the residence of the South Korean ambassador to the Vatican with Cardinal Secretary of State Pietro Parolin, who had officiated the mass. During the two-hour dinner, Moon said that “it felt like a dream to attend mass and then speak at St. Peter’s Basilica,” according to Senior Secretary to the President for Public Relations Yoon Young-chan.

“There’s a Korean proverb that says that if you’re sincere enough, you can move the heavens. I’ve got this feeling that peace will really be achieved on the Korean Peninsula,” Moon said.

“Because of the Pyongyang Joint Declaration, we’re working on clearing mines and removing soldiers and weapons from the area around Panmunjom. Panmunjom will now become a symbol of peace on the Korean Peninsula.”

“I too think the Lord will have to answer our prayers. Our prayers have been truly intense, and I believe the Lord has heard them,” Parolin said in response.

Parolin offered Moon words of encouragement. “You took a big step when you met the North Korean leader, Your Excellency, and I think that things are going to keep going well in the future.”

“I had an eye on the crowd during your speech, Your Excellency, and all the believers seemed to be hanging on your every word. It wasn’t just another speech; they all seemed to be convinced of what you were saying.”

Parolin personally officiated over the mass for peace on the Korean Peninsula that was held at St. Peter’s Basilica. At the beginning of the mass, he delivered a greeting in Korean: “I would like to welcome Their Excellencies President Moon Jae-in and first lady Kim Jung-sook. I offer the blessing of His Holiness Pope Francis. Let us pray for peace on the Korean Peninsula.”




Participants at the mass smiled in apparent delight at the cardinal’s use of the Korean language. After mass, Moon delivered a commemorative speech that lasted about 12 minutes. It is “very special and unusual” for the president of a particular country to deliver such a speech, the Vatican explained. After the speech, Moon walked down from the pulpit alongside Parolin. When Moon remarked that the mass had “conveyed an earnest desire for peace on the Korean Peninsula,” Parolin replied, “Let us continue to pray.”

“I’ve been at the Vatican for nine years now, and I’ve never seen a visiting foreign leader deliver a speech before. It’s also extremely rare for Parolin to personally officiate the mass,” said a nun who attended mass. “I feel very proud.”

According to reports, the Vatican readily accepted the South Korean proposal for Moon to deliver a speech. “During the deliberations over the itinerary [of Moon’s visit], we were the first to suggest attending a mass. When the Vatican asked what the mass’s theme should be, we proposed the theme of peace on the Korean Peninsula,” said Kwon Hyeok-u, a South Korean diplomat to the Vatican.

“When the Vatican asked what President Moon wanted to do, he said he wanted to deliver a speech. The Vatican accepted this idea, leading to the rare occurrence of a presidential speech [at St. Peter’s Basilica],” Kwon said.

By Seong Yeon-cheol, staff reporter

Please direct comments or questions to [english@hani.co.kr]"
Moon secures Pope’s consent for visit to North Korea,2018-10-19 14:49,North Korea,Seong Yeon-cheol,"“Don’t stop, and keep moving forward. Don’t be afraid,” said Pope Francis, speaking to a special believer named Timothy who visited him on Oct. 18.

Pope Francis was telling South Korean President Moon Jae-in, whose saint’s name is Timothy, not to stop working for peace on the Korean Peninsula. “I strongly support the South Korean government’s ongoing efforts to promote the peace process on the Korean Peninsula,” the pope said, making clear that he stands behind Moon.

Pope Francis’s staunch support for peace on the Korean Peninsula exceeded expectations. Even before the meeting, Blue House officials said they didn’t expect the pope to clearly express his willingness to visit North Korea and thought the best case scenario was that he would ‘seriously consider’ it. But the pope explicitly said he was willing to visit North Korea and would definitely respond if he received an invitation from the North. He also voiced his strong support for Moon’s plan for peace on the Korean Peninsula. For Moon, the papal response was an unexpected boon that delivered everything he had hoped and more.



Pope Francis’ immediate acceptance of the proposed papal visit to North Korea is consistent with the interest and affection he has shown for the divided Korean Peninsula. The Argentine pope has long taken an unusual interest in peace on the Korean Peninsula. In Aug. 2014, he chose South Korea for his third visit as pope, and his first to Asia, and he has prayed for the peace of the Korean Peninsula whenever Korean affairs have been at a critical juncture, including the Pyeongchang Winter Olympics, the inter-Korean summit and the North Korea-US summit.

At every opportunity, Moon has also expressed his gratitude for the pope’s prayers on social media. The pope has also taken personal action on behalf of inter-Korean reconciliation, such as supporting a reconciliation event in a meeting with Protestant representatives from South and North Korea in Geneva, Switzerland, this past June. When Moon asked the pope on Oct. 18 whether Kim Jong-un could send an invitation, the pope expressed his trust in Moon as messenger by saying, “President Moon, the words you have conveyed are sufficient in themselves, but it would be nice to receive an official invitation.” When Moon conveyed Kim’s message of gratitude for the pope’s prayers for inter-Korean peace, the pope said, “In fact, it is I who am grateful,” showing that he is well-disposed to Kim.



By securing Pope Francis’ consent for a visit to North Korea, South Korean President Moon Jae-in has achieved the main goal of his tour of Europe. The Blue House had said that “the primary objective of this trip is to communicate Chairman Kim’s intention to request a papal visit.”

In a column published in L'Osservatore Romano, the daily newspaper of Vatican City in Rome, Moon expressed his “hope that exchange will be further promoted between the Vatican and North Korea” in a veiled request for the pope to visit the North soon. A papal visit could function as a “certified check” for a Korean Peninsula at peace, without war.

Pope Francis’ support has given Moon’s plan for peace on the Korean Peninsula a major boost. Moon’s plan is to build a peace and security regime in Northeast Asia that would play out through an end-of-war declaration within the year, the signing of a peace treaty and the dissolution of the Cold War alignment. The reason the Blue House settled on arranging a papal visit to North Korea as the primary objective of Moon’s trip to Europe is because of its belief that the support of the pope – a symbol of peace and reconciliation who leads 1.2 billion believers around the world – could help further accelerate the newly established order on the Korean Peninsula.

This also puts more weight behind Moon’s central theme during his tour of Europe that sanctions on North Korea should be eased to promote the North’s denuclearization. The pope exerts influence over the Catholic countries of Europe, including France and Italy. After his summits with the leaders of France and Italy, Moon tried to persuade them that “the international community’s sanctions on the North should be eased after denuclearization has progressed to an irreversible point,” and he is expected to make the same case to the leaders of the UK and Germany, whom he will meet during the Asia-Europe Meeting (ASEM) in Belgium.

By Seong Yeon-cheol, staff reporter

Please direct comments or questions to [english@hani.co.kr]"
Pope’s visit to North Korea becomes plausible reality,2018-10-19 14:47,North Korea,Lee Je-hun,"“It’s a pleasure to meet you,” said Korean Christian Federation chairman Kang Myong-chol.

“Peace!” replied Pope Francis, smiling brightly.

The Pope’s meeting with a representative of the North Korean Christian community at a 70th anniversary event for the World Council of Churches (WCC) in Geneva on June 21 was arranged by figures from the South Korean religious community. It was Pope Francis’ first meeting with a North Korean since being named Pope in Mar. 2013.

The idea of the Pope visiting Pyongyang and meeting with North Korea’s 25 million people is no longer just a dream, but something that could soon be a reality. Following his declaration in an Oct. 18 meeting with South Korean President Moon Jae-in that he would “unquestionably answer an [official] invitation” from North Korean leader Kim Jong-un and “could go” to North Korea, the questions of when and how Pope Francis might visit North Korea have become the focus of global attention.



But while the Pope’s strong commitment may have been established, many hurdles remain to be cleared for an official visit to take place. According to canon law, a formal invitation must be extended by a country’s government and Catholic church (the diocese leader for the city being visited) for the Pope to visit a specific country. If he does visit, he is to be met by the chairperson of the Catholic Bishops’ Conference of Korea and the bishop of the diocese in the city being visited – an unwritten rule that has established itself as a tradition.

The individual recognized by the Vatican as (acting) bishop of the Pyongyang diocese is Archbishop Andrew Yeom Soo-jung. The administrative requirements would be met with formal invitations from Kim Jong-un and Yeom as acting bishop. Under the current state of affairs, Pope Francis would have to be met by Yeom if he visits Pyongyang.

This would cause a burden for both North Korean authorities and the Vatican. Sources in the religious community said North Korea, with all its emphasis on “autonomy” and “sovereignty,” is unlikely to accept the Pope being met by the South Korean Yeom on behalf of the North Korean Catholic Church – even if the improvement in trust between the two sides after three summits this year is taken into account.



The Vatican is a similarly awkward spot. North Korea has around 3,000 people registered with authorities as Catholic, but not a single priest. As a sovereign state, the Vatican City focuses on “spreading the gospel” and “guarding world peace and human rights” in its diplomacy. It’s an approach that factors into the Vatican’s lack of diplomatic ties to North Korea or socialist China and Vietnam despite relations with 183 other countries, including South Korea.

In the case of China, which has around 8 million Catholics, the longstanding conflict over the appointment of bishops now stands to be resolved after the two sides signed a preliminary agreement on the matter on Sept. 22. Two Chinese bishops visited the Vatican on Oct. 16 to convey plans to invite the Pope for a visit. This explains the current hopeful predictions that a China visit by Pope Francis may be in the offing. China has not had diplomatic relations with the Vatican since severing them in 1951.

Vietnam’s 6 million Catholics represent the second-highest number in Southeast Asia after the Philippines, and the country has a cardinal appointed by the Pope. Yet the Pope himself has never visited, and diplomatic ties have not been established despite long efforts by the Vietnamese government.




The condition of Catholicism in North Korea is far worse than in either China or Vietnam. Diplomatically, the issue is a thorny one where South Korean Catholicism exercises representation. For this reason, some are predicting that Pope Francis – a self-professed “pilgrim of peace” – is unlikely to pay an official visit to North Korea in the short term.

“It is the clear position of the Holy See Secretariat of State that a visit to Pyongyang by the Pope must be carried out in combination with the promotion of peace on the Korean Peninsula and pastoral aims,” a high-ranking figure in the South Korean Catholic community said. “There are a lot of problems that would need to be solved.”

Because of this situation, staging the visit sooner would require either an exceptional decision by the Pope or some form of workaround.

“The most realistic way of helping the Pope’s Pyongyang visit and meeting with Kim Jong-un happen quickly would be for the Pope to visit South Korea in the near future, using that as an occasion for visiting Pyongyang with representatives of the South Korean religious community,” a high-ranking figure in the religious community said.

“The situation for the North Korean church would have to improve a lot for the Pope to formally visit North Korea, and that’s not something that can be fixed in the short term,” the same figure said. A drawback of the proposed approach is that it would not actually be an official papal visit.

“An official visit by the Pope would be the best way for North Korea to emerge into the international community with its aspirations of being a normal state, and it would be very helpful for peace on the Korean Peninsula,” said Fr. Park Chang-il, who chairs the steering committee of the North Korea assistance group Peace 3000.

“The Vatican and North Korea and South and North Korea need to start now opening everything up to discussions and finding a way,” Park said.

By Lee Je-hun, senior staff writer

Please direct comments or questions to [english@hani.co.kr]"
Debate surrounds issue of what constitutes “irreversible denuclearization”,2018-10-19 14:44,North Korea,Kim Ji-eun,"The definition of “irreversible stage of denuclearization” is becoming a heated topic after South Korean President Moon Jae-in made remarks during his recent European tour calling for “further efforts to promote denuclearization by loosening UN sanctions once we have determined North Korea’s denuclearization has reached an irreversible stage.”

Neither the Blue House nor the Moon administration have yet offered a concrete explanation, while US nuclear experts have argued that the concept of “irreversible denuclearization” is impossible to define.

Voice of America quoted former International Atomic Energy Agency (IAEA) deputy director-general Olli Heinonen on Oct. 18 as saying two key measures would be needed to determine North Korea’s denuclearization had reached an “irreversible” stage. Specifically, it would require the overseas removal of all nuclear weapons from the North and the prior dismantling or disablement of facilities to produce highly enriched uranium, plutonium, and other nuclear materials, he said. Verification of these measures would also have to be included, he added.

Heinonen further said it would be impossible to conclude North Korea’s denuclearization had reached an “irreversible” stage even if it completed permanent dismantling and verification procedures for its nuclear facilities at Yongbyon. The claim is that because of the possibility that North Korea has at least one more enrichment facility outside of the Yongbyon complex, it could still produce highly enriched uranium even after the Yongbyon facility has been dismantled.

Because the precise scale of nuclear material in North Korea’s possession has not been established, measures beyond the Yongbyon facility’s dismantlement would be needed for denuclearization to reach an irreversible stage, Heinonen said.

Nuclear expert and Institute for Science and International Security (ISIS) president David Albright was reported by the same network as saying an “irreversible” stage of denuclearization was impossible to define. He too cited the lack of precise knowledge about the scale of North Korea’s nuclear weapons. Noting that dismantling and verification of the nuclear facilities at Yongbyon and elsewhere would represent major progress, he cautioned at the same time against overlooking the fact that North Korea still possesses dozens of nuclear weapons.

By Kim Ji-eun, staff reporter

Please direct comments or questions to [english@hani.co.kr]"
