제목,날짜,분류,기자,본문
US in direct correspondence with N. Korean lieutenant general regarding POW/MIA remains,2018-10-30 17:06,North Korea,Lee Je-hun,"Kelly McKeague, director of the US Defense POW/MIA Accounting Agency (DPAA), has been directly corresponding with North Korean Lieutenant General An Ik-san to discuss the recovery of the remains of US soldiers killed in North Korean territory during the Korean War. This discussion includes details such as the timeframe, method and conditions for the exhumation efforts, which were agreed to in the joint statement signed by North Korean leader Kim Jong-un and US President Donald Trump on June 12.

“During the letters I’ve exchanged with North Korean Lieutenant General An Ik-san, we’ve discussed concrete details such as the timeframe of the recovery. I sent my most recent letter to An three weeks ago,” McKeague said. He made these remarks during an interview that took place when a South Korean delegation from the South Korea-US Security Forum visited DPAA, which is located at the US Indo-Pacific Command in Hawaii, on Oct. 23.

“My most recent letter deals with related areas of progress, including the fact that the proposal we’re going to give North Korea hasn’t been finalized but probably will be within two weeks,” McKeague said, without getting into the details of the proposal that the US government is working on.

“DPAA is directly responsible for the recovery of remains,” McKeague said, adding that he’d “received permission from Secretary of State Mike Pompeo to directly contact An Ik-san for deliberations” without specifying the timing. McKeague emphasized that DPAA has been authorized by Pompeo to “contact and deliberate with the North Koreans regardless of whether there is progress toward denuclearization.”

“Lieutenant General An and I have been exchanging letters by way of the North Korean [and American] delegations to the UN in New York,” McKeague added.

In a statement released on July 15, Pompeo said that North Korea and the US “agreed to re-commence field operations in the DPRK to search for the estimated 5,300 Americans who never returned home” during general-level military talks that were held between the UN Command and the North Korean military at Panmunjom on the same day. At the time, Pompeo did not mention any of the details of the recovery operations, such as timeframe or method, but the correspondence with An Ik-san mentioned by McKeague appears to serve as the follow-up deliberations to those general-level talks.

“Next year, we’re planning to work on recovering the remains of American soldiers in 47 countries around the world, and North Korea is obviously one of those. But the final decision hasn’t been made on the question of recovering remains in the North Korean region,” McKeague said.

“I hope our deliberations with North Korea will go well so that we can resume the recovery efforts with the North Koreans at Jangjin Lake and Unsan County in March of next year,” McKeague said, adding that “By our calculations, over a thousand American soldiers were lost around Jangjin Lake and over a thousand were lost around Unsan County during the Korean War.”

An Ik-san, whom McKeague has identified as his counterpart in the negotiations, is one of the top negotiators in the North Korean military, and he’s in charge of the North Korean People’s Army’s delegations to general-level military talks with the UN Command and with South Korea. McKeague said that An also attended the repatriation ceremony of the remains of American soldiers that took place at Wonsan’s Kalma Airport on July 27.



Jennie Jin (Korean name Jin Ju-hyeon), an anthropologist who works at DPAA’s Central Identification Laboratory, was at Wonsan when the remains were repatriated. “When we arrived at Wonsan, the North Koreans were well-prepared; for each of the 55 boxes [containing the remains of American soldiers], they’d brought personal effects and detailed records of their recovery. Thanks to that, the work proceeded in a very amicable atmosphere,” Jin said.

“Because so much time has passed, none of the 55 boxes sent by the North Koreans contain the complete remains. But in September, we managed to identity two American soldiers. With one of two identified soldiers, the North Korean officials’ hints were a big help because they gave us a set of dog tags and said the owner of the tags was definitely in a certain box or one of the boxes around it,” Jin said.

“Some people say that some of the remains of American soldiers that North Korea has sent are actually animal bones, but that’s not true. So far, the North Koreans have never sent the US animal bones.”

By Lee Je-hun, senior staff writer

Please direct comments or questions to [english@hani.co.kr]"
Biegun meets with Blue House chief of staff to discuss inter-Korean cooperation,2018-10-30 17:03,North Korea,Noh Ji-won,"On Oct. 29, US Special Representative for North Korea Stephen Biegun had a one-hour meeting with Blue House Chief of Staff Im Jong-seok, during which the two worked to harmonize the two sides’ positions on inter-Korean cooperation projects. During earlier meetings with South Korean Foreign Minister Kang Kyung-wha and Lee Do-hoon, South Korea's special representative for Korean Peninsula peace and security affairs, Biegun promised that the US would “cooperate closely” with South Korea on improving not only North Korea-US relations but also inter-Korean relations.

The meeting between Im and Biegun, which was held at the request of the US, was inherently unusual. While it’s true that Im also chairs a committee charged with implementing inter-Korean summit declarations, matters concerning foreign policy and security, including establishing peace and denuclearizing the Korean Peninsula, are in the portfolio of Blue House National Security Office Director Chung Eui-yong.

The Blue House explained that Im asked Biegun to bring the North Korea-US talks to a successful conclusion and that Biegun asked the South Korean government for assistance, without providing any details about the meeting. But since a senior government official said that Biegun’s visit to South Korea was focused more on aligning South Korea and the US’s positions than on working-level meetings between North Korea and the US, it would appear that Biegun and Im’s discussion focused on resolving disagreements between South Korea and the US over inter-Korean cooperation projects, including the connection of inter-Korean roads and railways and businesspeople visiting the Kaesong Industrial Complex to inspect their facilities there.

Such trends in the US government may have played a role in Biegun’s surprising visit to Seoul so soon after holding deliberations in Washington just last week with Lee Do-hoon, observers say.

In a related story, Biegun met with Kang Kyung-wha on Monday morning for 45 minutes, longer than the 30 minutes that had originally been scheduled. Kang dedicated a considerable amount of time not only to hearing from Biegun about progress in North Korea-US relations, including the high-level talks and working-level talks, but also to sharing opinions about progress in inter-Korean relations, and she reportedly expressed her agreement with the need for close communication and cooperation between South Korea and the US.

The urgent inter-Korean cooperation projects that the two sides need to discuss include tenant business owners visiting the Kaesong Complex and linking South and North Korea’s roads and railways. South Korea and the US are reportedly putting considerable weight on bilateral cooperation on matters including asking the UN Security Council to provide an exemption from sanctions for inter-Korean cooperation projects such as the inter-Korean joint survey of the Gyeongui (Seoul-Sinuiju) and East Sea railroads and a groundbreaking ceremony before the end of the year.

Biegun continued related discussions during meetings with Chung Eui-yong and Minister of Unification Cho Myoung-gyon on the afternoon of Oct. 30. Cho addressed this issue during a parliamentary audit of the Unification Ministry at the National Assembly’s Foreign Affairs and Unification Committee on Monday. In regard to the issue of the joint survey of the Gyeongui line, Cho said, “The US isn’t at the point where it’s expressing opposition to inter-Korean projects. We’re in a rather cooperative phase in which we’re continuing our discussions with the US.”

Cho did acknowledge that “there are some areas where our ideas are somewhat different from the Americans.”

In connection with the issue of denuclearization, Biegun said during his meeting with Lee Do-hoon that the US is completely certain that the goal of North Korea’s final, fully verified denuclearization is capable of being realized. Just when concerns are being raised that the North Korea-US negotiations are at an impasse, an official involved in North Korea-US working level talks has expressed his optimism about those negotiations.

By Noh Ji-won and Kim Bo-hyeop, staff reporters

Please direct comments or questions to [english@hani.co.kr]"
South and North Korea complete removal of outposts and firearms from JSA,2018-10-29 17:54,North Korea,Yoo Kang-moon,"South and North Korea’s joint verification of the removal of outposts and firearms from the Joint Security Area (JSA) at Panmunjom was completed on schedule on Oct. 27, leading to expectations that civilians and tourists will be able to access the area freely as early as the beginning of November.

“During the two days from Oct. 26 to 27, South Korea, North Korea and the UN Command carried out a joint verification of the measures to demilitarize the JSA. Nothing unusual was found during the joint verification,” an official from South Korea’s Defense Ministry said on Oct. 28.


The decision to demilitarize the JSA was made in the Comprehensive Military Agreement (CMA), which was signed on Sept. 19. In accordance with this agreement, South and North Korea worked on clearing mines from Oct. 1 to 20, removed all firearms and military personnel from five North Korean guard posts and four South Korean guard posts in the JSA through Oct. 25 and verified this work along with the UN Command from Oct. 26 to 27.

In order to enable civilians and tourists to travel freely in the area, South Korea, North Korea and the UN Command are planning to continue setting up new guard posts and adding surveillance equipment.

“We believe that free travel will become possible as early as next month and within the year at the latest,” the Defense Ministry official said.


　
By Yoo Kang-moon, senior staff writer

Please direct comments or questions to [english@hani.co.kr]"
Moon expresses willingness to give Kim Jong-un tour of Mt. Halla during reciprocal visit to Seoul,2018-10-29 17:53,North Korea,Kim Bo-hyeop,"On Oct. 28, South Korean President Moon Jae-in mentioned the Korean expression “from Mt. Baekdu to Mt. Halla” while saying he would be willing to give North Korean leader Kim Jong-un a tour of Mt. Halla if he wants to during his reciprocal visit to Seoul.

Moon made the remarks on the morning of Oct. 28 in response to a question about Kim’s visit while he was hiking on Mt. Bugak, behind the Blue House, with Blue House press corps.

“I received such a warm welcome on my last visit [to North Korea] that I’m not sure where I ought to take Chairman Kim when he actually pays a return visit. Since the schedule hasn’t been nailed down, we aren’t making any plans yet. We still don’t know how much time he’ll be spending here, but once the schedule is set we’ll work within those parameters,” Moon added.

When Moon was asked which goals he wants the government to focus on with barely two months left in the year, he chose the areas of the economy and the peace process on the Korean Peninsula.

“If this were a household, I guess we could do home repairs this month and get ready for winter next month, but when you’re running the government, multiple projects have to move forward simultaneously,” Moon observed.

“Both in terms of foreign policy and the economy, there’s a lot of work to do. And so that’s not an easy question to answer, but at any rate we’ll be working with North Korea on the one hand and with the US on the other hand to ensure the ongoing peace process does not fail and we make the most of opportunities,” he said.

While Kim and Moon reached an agreement in Panmunjom on Apr. 27 to formally declare the end of the Korean War within the year and agreed in the Pyongyang Joint Declaration, signed on Sept. 19, that Kim would pay a reciprocal visit to Seoul. Carrying out those agreements will depend on Kim’s second summit with US President Donald Trump. As such, Moon’s remarks are taken to mean he will put an even greater effort into mediating between North Korea and the US and facilitating an improvement in their relations with the goal of bringing peace and denuclearization to the Korean Peninsula.


Moon made the following remarks about economic problems: “We’ll continue providing relief for difficulties with the public livelihood, which are evident to the public whatever the macro economic indicators may say, while also energetically moving ahead with our policy platform of income-led growth, innovative growth and a fair economy. The conclusion of this session of the National Assembly will be crucial toward this end. We need a lot of legislative support, and in that sense we’ll do our best to cooperate with the National Assembly to ensure that the necessary budget bill passes.”

On Nov. 1, Moon will be delivering an administrative policy speech to the National Assembly in which he asks both the ruling and opposition parties for their cooperation in passing the budget bill and other legislation.

The hike on Sunday began around 11 am at Hongryeon Temple on the east side of Mt. Bukak and lasted for two hours, passing through Sukjeong Gate, along the Baegak Valley fortifications and Cheongundae to Changui Gate. Moon was accompanied by Lim Jong-seok, his chief of staff, along with a number of his senior secretaries, including Han Byeong-do (political affairs), Cho Guk (civil affairs), Lee Yong-seon (civic society), Yoon Young-chan (public relations) and Jung Tae-ho (jobs).

By Kim Bo-hyeop, staff reporter
Please direct comments or questions to [english@hani.co.kr]"
[Photo] Biegun pays courtesy visit to Kang Kyung-wha,2018-10-29 17:27,North Korea,,"US Special Representative for North Korea Stephen Biegun paid a courtesy call to South Korean Foreign Minister Kang Kyung-wha at the Ministry of Foreign Affairs (MOFA) in Seoul on Oct. 29. After discussing strategies and measures for denuclearization and inter-Korean cooperation projects with Kang, Biegun met with Lee Do-hoon, South Korea's special representative for Korean Peninsula peace and security affairs, for additional talks. Biegun was seen carrying a detailed map of the Korean Peninsula devoted particularly to the geography of North Korea, spawning speculations concerning the discussion of specific observation and inspection process for North Korea’s denuclearization. The second photo shows Biegun (second from left) with Lee (second from right) during their meeting at MOFA. (photo pool)"
S. Korea to provide US$8.6 mln in support to repair facilities at inter-Korean joint liaison office,2018-10-25 15:19,North Korea,Noh Ji-won,"The South Korean government is providing 9.78 billion won (US$8.6 million) in inter-Korean cooperation fund support to cover facility repairs and renovations carried out ahead of the opening of an inter-Korean joint liaison office in the Kaesong Industrial Complex

At a 298th Inter-Korean Exchange and Cooperation Promotion Council meeting on Oct. 17–24, the South Korean government approved a plan to use the inter-Korean cooperation fund to support repairs and renovations for the office’s opening, the Ministry of Unification reported on Oct. 24. As of late September, costs of 9.78 billion won (US$8.6 million) were incurred with supervision, adjustment, and other verification procedures after the majority of repair and renovation work was completed.

Participants in the council including vice minister-level officials from the Ministry of Economy and Finance; Ministry of Foreign Affairs; Ministry of Justice; Ministry of Trade, Industry and Energy; and Ministry of Land, Infrastructure and Transport. Participating experts included Seoul National University Professor Kim Byung-yeon, University of North Korean Studies Professor Kim Sung-kyung, Dongguk University Professor Kim Yong-hyun, Korea Women's Institute for Peace Studies Director Kim Jeong-su, and Handong University Professor Kim Joon-hyung.

In their Apr. 27 Panmunjom Declaration, South and North Korea agreed to establish a joint inter-Korean liaison office; in high-level talks on June 1, it was agreed that the office would be opened in the Kaesong Complex. Since July 16, construction workers have been present at the site carrying out repair and renovations as needed for related facilities, including the building to house the office, room and board to permanent employees, and filtration/drainage and wastewater/waste treatment sites.

By Noh Ji-won, staff reporter

Please direct comments or questions to [english@hani.co.kr]"
South and North Korea to hold 10th round of general-level military talks,2018-10-25 15:17,North Korea,Yoo Kang-moon,"South and North Korea are holding a tenth round of general-level military talks at Panmunjom on Oct. 26 to discuss the composition and management of an Inter-Korean Joint Military Committee to implement the military agreement (Comprehensive Military Agreement, or CMA) adopted alongside the Pyongyang Joint Declaration on Sept. 19.

The CMA states that the two sides’ agreement to operate an Inter-Korean Joint Military Committee to consult on “matters including large-scale military exercises and military buildup aimed at each other, various forms of blockade, interdiction and obstruction of navigation as well as reconnaissance activities against each other,” in addition to establishing a maritime peace zone and joint fishing zone in the West (Yellow) Sea region.

For the committee’s composition and management, the South Korean government plans to apply a May 1992 agreement on Inter-Korean Joint Military Committee formation and operation, it was reported on Oct. 24. At the time, South and North agreed to form a committee consisting of one vice minister-level chairperson, one deputy chairperson, and five additional members from each side. According to that agreement, meetings were to be held once a quarter as a rule, with the possibility of additional meetings to be formed by the two sides as needed.



Vice minister of national defense Suh Choo-suk is seen as a likely candidate to serve as the committee’s South Korean chairperson. On the North Korean side, one of the vice ministers from the Ministry of People’s Armed Forces is expected to serve as chairperson. North Korea’s Ministry of People’s Armed Forces has multiple vice ministers with different roles, including first vice minister So Hong-chan. In view of the stature of the talks, the South Korean Ministry of National Defense is reportedly hoping So will serve as North Korean chairperson.

But with So’s area of specialization as first vice minister bearing little connection to inter-Korean talks or military diplomacy, observers are waiting in anticipation of North Korea’s choice. As a general, So also reportedly serves as director of the General Rear Services Department, which is in charge of food, clothing, and other material supplies. Another vice minister, Lt. Gen. Kim Hyong-ryong, is in charge of military diplomacy for the ministry. Accordingly, some are predicting that Kim, who is responsible for military diplomacy as a vice minister, could participate as chairperson on the North Korean side.

As it happens, So and Kim are both attending the Xiangshan Forum, a multilateral security dialogue meeting in Beijing from Oct. 24 to 26. The forum, which is being attended by senior defense officials and security experts from 67 countries in the Asia/Pacific region, Europe, and Africa, includes discussions on international security cooperation, terrorism, and the new dynamics in Northeast Asia. The South Korean Ministry of National Defense said there were no plans for their separate meeting, but the possibility cannot be ruled out.



Once the Inter-Korean Joint Military Committee is established, the issue of standards for determining the extent of the West Sea maritime peace zone and joint fishing zone will come up for discussion. Seoul is adamant that the Northern Limit Line (NLL) should serve as the standard, while Pyongyang is expected to continue insisting on its own security boundary line standard. Some observers fear the committee could end up adrift in the debate over the NLL.

The general-level talks are also expected to assess developments in the implementation situation since the Sept. 19 military agreement was reached and a schedule for future implementation. In November, the two sides are to initiate practical measures to suspend hostile actions, including a halt to regiment-level exercises in the Military Demarcation Line (MDL) area, the application of no fly zones, and a suspension of live-fire drills and marine action exercises in buffer zone waters. Guard posts and firearms are to be withdrawn from the Joint Security Area (JSA) on both sides as of Oct. 25.

By Yoo Kang-moon, senior staff writer

Please direct comments or questions to [english@hani.co.kr]"
National Assembly in dispute over constitutionality of Moon’s ratification of Pyongyang Declaration,2018-10-25 15:14,North Korea,Lee Jeong-hun,"After South Korean President Moon Jae-in ratified the Pyongyang Joint Declaration and the Agreement on the Implementation of the Historic Panmunjom Declaration in the Military Domain (also called the Comprehensive Military Agreement, or CMA) during a Blue House cabinet meeting on Oct. 23, a dispute has erupted over the constitutionality of this action.

The Liberty Korea Party claimed that it was unconstitutional to ratify those agreements without the consent of the National Assembly and promised to take legal action, including asking the Constitutional Court to adjudicate authority on the matter and requesting an injunction suspending the ratification’s legal force. The Blue House fired back that the very act of calling this unconstitutional is unconstitutional.

Article 60, Clause 1, of the South Korean Constitution states that “The National Assembly shall have the right to consent to the conclusion and ratification of treaties pertaining to mutual assistance or mutual security; [. . .] treaties which will burden the State or people with an important financial obligation; or treaties related to legislative matters.”

The Liberty Korea Party, the main conservative opposition, contends that the CMA, which would establish a maritime buffer zone and suspend air reconnaissance activity, counts as a “treaty pertaining to [. . .] security” and that therefore it requires the consent of the National Assembly.

“The question of whether to consent to the ratification of grave matters related to the state’s foreign policy and security is something that must be judged carefully through debate in the National Assembly,” said Liberty Korea Party Floor Leader Kim Sung-tae during a press conference held at the National Assembly on Oct. 24.

Kim also argued that it “it’s not correct in terms of jurisprudence” to ratify the Pyongyang Declaration and the CMA when the Apr. 27 Panmunjom Declaration, which came first, has yet to be ratified by the National Assembly. “This is tantamount to creating the enforcement decree before the actual law has been framed, or to reporting a birth before the baby has been delivered,” he said.



The Blue House countered that “under the South Korean legal system, North Korea is not a state, and therefore any agreements made with the North or promises made to it are not treaties. The Constitution is not applicable here.”

“The treaties mentioned in Article 60 of the Constitution refer to documentary agreements between different states,” Blue House Spokesperson Kim Eui-kyum said during a meeting with reporters on Wednesday, explaining that the inter-Korean agreements do not fall under the scope of the “treaties” that must receive the approval of the National Assembly. In the Development of Inter-Korean Relations Act, inter-Korean relations are defined not as a relationship between states but as a special relationship tentatively formed during the process of moving toward unification.

“Considering that South Korea’s Constitutional Court and Supreme Court have stated categorically that previously concluded inter-Korean agreements are not subject to the Constitution, the assertion that the ratification of the Comprehensive Military Agreement is unconstitutional is a clear violation of the Constitutional Court’s decision and Supreme Court precedent,” Kim said.

“On a more fundamental level, calling this unconstitutional constitutes an undeniable acknowledgment of North Korea as a state. That contradicts Article 3 of the Constitution, which states that ‘The territory of the Republic of Korea shall consist of the Korean peninsula and its adjacent islands.’ The very argument that this is unconstitutional is in fact unconstitutional.”

By Lee Jeong-hun and Seong Yeon-cheol, staff reporters

Please direct comments or questions to [english@hani.co.kr]"
