제목,날짜,분류,기자,본문
Access to market key issue in North Korea's food security ,2018-11-01 15:10,North Korea,,"By Jung Da-minSome might think North Korea's food supply and demand would be unstable, but prices in the market are remarkably steady, according to Kwon Tae-jin, director of the Center for North Korean and Northeast Asian Studies at the GS&J Institute. It comes against the background that North Korea's rationing system does not work properly, Kwon said at the 2018 International Conference on Humanitarian and Development Assistance to the DPRK at the Kim Koo Museum in Seoul, Wednesday.The Korean Sharing Movement hosted the event with the Friedrich-Ebert-Stiftung Korea and Gyeonggi Province. Kwon said how to increase residents' access to the market or, more fundamentally, how to increase their incomes, was the priority. He also called for a review of the country's food security and its agricultural policies.Kwon attributed North Korea's stable food market prices to the country's unrecorded imports from neighboring countries including China.""Merchants are providing as much food as the people need,"" Kwon said. ""My presumption is that the unofficial total of imports would be much more than official imports.""Those with accessibility to the market and decent incomes were responsible for the changed patterns of food consumption that have been observed, Kwon said.""If it was the problem of gaining calories from grains in the past, now North Korean people want to eat protein, that is, meat, as well as vegetables and fruits,"" Kwon said.  By Jung Da-min  Some might think North Korea's food supply and demand would be unstable, but prices in the market are remarkably steady, according to Kwon Tae-jin, director of the Center for North Korean and Northeast Asian Studies at the GS&J Institute.  It comes against the background that North Korea's rationing system does not work properly, Kwon said at the 2018 International Conference on Humanitarian and Development Assistance to the DPRK at the Kim Koo Museum in Seoul, Wednesday.  The Korean Sharing Movement hosted the event with the Friedrich-Ebert-Stiftung Korea and Gyeonggi Province.  Kwon said how to increase residents' access to the market or, more fundamentally, how to increase their incomes, was the priority. He also called for a review of the country's food security and its agricultural policies.  Kwon attributed North Korea's stable food market prices to the country's unrecorded imports from neighboring countries including China.  ""Merchants are providing as much food as the people need,"" Kwon said. ""My presumption is that the unofficial total of imports would be much more than official imports.""  Those with accessibility to the market and decent incomes were responsible for the changed patterns of food consumption that have been observed, Kwon said.  ""If it was the problem of gaining calories from grains in the past, now North Korean people want to eat protein, that is, meat, as well as vegetables and fruits,"" Kwon said.  Yoon Ji-hyun, a professor in Seoul National University's Department of Food and Nutrition, said 40 percent of people still eat corn because they are poor, citing a survey in 2016 by Seoul National University's Institute for Peace and Unification Studies of about 100 defectors.""Only 18 percent, or one in five, eat protein including meat or fish on daily basis, while most people eat protein once or twice a week, or once or twice a month, according to the survey,"" Yoon said. She said many pregnant women and infants still suffer malnutrition. Although overall child malnutrition has decreased, the gap has widened between regions, with the chronic malnutrition rate at 10.1 percent in Pyongyang and 31.8 percent in Ryanggang Province in 2017 when the average was 19.1 percent, according to the ""Levels and Trends in Child Malnutrition"" report by UNICEF, the World Health Organization and World Bank Group.""According to a 2005 report titled 'Linkages between Poverty Reduction Strategies and Child Nutrition ― An Asian Perspective,' the rate at which nutritional status improves when economic conditions develop was estimated to be 50 percent. That is, if North Korea's GDP grows 10 percent, the rate of nutrition improvement would only be 5 percent,"" Yoon said.""The paper demonstrated it could be improved more efficiently only when there was a direct effort to improve the nutrition problem, and it could further lead to efficient development of the country's overall economy.""Other experts at the forum called on the international community to focus attention on humanitarian aid for North Korea, saying practical sanctions relief was needed.Among them were officials from NGOs providing humanitarian aid to North Korea, including Triangle Generation Humanitaire (TGH) and Christian Friends of Korea, and scholars from Korea, the U.S., China and Europe.Unification Minister Cho Myong-gyon made the keynote speech, saying the government is seeking to widen inter-Korean exchanges on sustainable development of the Korean Peninsula.  Yoon Ji-hyun, a professor in Seoul National University's Department of Food and Nutrition, said 40 percent of people still eat corn because they are poor, citing a survey in 2016 by Seoul National University's Institute for Peace and Unification Studies of about 100 defectors.  ""Only 18 percent, or one in five, eat protein including meat or fish on daily basis, while most people eat protein once or twice a week, or once or twice a month, according to the survey,"" Yoon said.  She said many pregnant women and infants still suffer malnutrition. Although overall child malnutrition has decreased, the gap has widened between regions, with the chronic malnutrition rate at 10.1 percent in Pyongyang and 31.8 percent in Ryanggang Province in 2017 when the average was 19.1 percent, according to the ""Levels and Trends in Child Malnutrition"" report by UNICEF, the World Health Organization and World Bank Group.  ""According to a 2005 report titled 'Linkages between Poverty Reduction Strategies and Child Nutrition ― An Asian Perspective,' the rate at which nutritional status improves when economic conditions develop was estimated to be 50 percent. That is, if North Korea's GDP grows 10 percent, the rate of nutrition improvement would only be 5 percent,"" Yoon said.  ""The paper demonstrated it could be improved more efficiently only when there was a direct effort to improve the nutrition problem, and it could further lead to efficient development of the country's overall economy.""  Other experts at the forum called on the international community to focus attention on humanitarian aid for North Korea, saying practical sanctions relief was needed.  Among them were officials from NGOs providing humanitarian aid to North Korea, including Triangle Generation Humanitaire (TGH) and Christian Friends of Korea, and scholars from Korea, the U.S., China and Europe.  Unification Minister Cho Myong-gyon made the keynote speech, saying the government is seeking to widen inter-Korean exchanges on sustainable development of the Korean Peninsula. "
Koreas halt all 'hostile' military acts near border ,2018-11-01 10:28,North Korea,,"The armed forces of South and North Korea on Thursday ceased all ""hostile acts"" against each other as part of a set of confidence-building measures under a summit deal, defense authorities in Seoul said.The comprehensive military agreement, signed on Sept. 19 during their summit talks, took effect at the beginning of the day, banning hostility in every space: land, sea and air.It also calls for the creation of buffer zones in border areas aimed at preventing accidental clashes and avoiding war.The two sides are prohibited from conducting live-fire artillery drills and regiment-level field maneuvering exercises or those by bigger units within 5 kilometers of the Military Demarcation Line (MDL).No-fly zones have been established along the Demilitarized Zone (DMZ) as well to ban the operation of drones, helicopters and other aircraft over an area up to 40 km away from the MDL.The Koreas created peace zones near their disputed Yellow Sea border.""North Korea has implemented measures to stop hostile acts in accordance with the military agreement, including the recent closure of coastline artillery,"" the South's Ministry of National Defense said. (Yonhap)  The armed forces of South and North Korea on Thursday ceased all ""hostile acts"" against each other as part of a set of confidence-building measures under a summit deal, defense authorities in Seoul said.  The comprehensive military agreement, signed on Sept. 19 during their summit talks, took effect at the beginning of the day, banning hostility in every space: land, sea and air.  It also calls for the creation of buffer zones in border areas aimed at preventing accidental clashes and avoiding war.  The two sides are prohibited from conducting live-fire artillery drills and regiment-level field maneuvering exercises or those by bigger units within 5 kilometers of the Military Demarcation Line (MDL).  No-fly zones have been established along the Demilitarized Zone (DMZ) as well to ban the operation of drones, helicopters and other aircraft over an area up to 40 km away from the MDL.  The Koreas created peace zones near their disputed Yellow Sea border.  ""North Korea has implemented measures to stop hostile acts in accordance with the military agreement, including the recent closure of coastline artillery,"" the South's Ministry of National Defense said. (Yonhap) "
'North Korea closed part of nuclear and missile test sites' ,2018-10-31 16:57,North Korea,,"By Park Ji-wonNorth Korea has cleared some of its Tongchang-ri missile testing sites and shut down the Punggye-ri nuclear testing site, the National Intelligence Service (NIS) said Wednesday.""The spy agency observed the North's activities which are assumed to be preparation or assumed an inspection before letting international experts in for an inspection, as part of efforts to take pre-measures for denuclearization,"" the NIS was quoted as saying by Rep. Kim Min-ki of the ruling Democratic Party of Korea (DPK) who was briefed by the NIS during a closed-door National Assembly audit along with Rep. Lee Eun-jae of the main opposition Liberty Korea Party.Upon U.S. Secretary of State Mike Pompeo's fourth visit to North Korea, North Korean leader Kim Jong-un agreed to allow international inspectors into the key nuclear testing site that the North has claimed it destroyed.The NIS said the spy agency is taking a close look into the North's nuclear- and missile-related facilities such as the Yongbyon facility while saying it is considering various possibilities of the North's moves. But no major moves have been seen lately, the intelligence agency added.In May, the North showed the moment the Punggye-ri nuclear test site was demolished before foreign journalists. The North has conducted all six of its nuclear tests at the site, including the latest in September 2017. By Park Ji-won  North Korea has cleared some of its Tongchang-ri missile testing sites and shut down the Punggye-ri nuclear testing site, the National Intelligence Service (NIS) said Wednesday.  ""The spy agency observed the North's activities which are assumed to be preparation or assumed an inspection before letting international experts in for an inspection, as part of efforts to take pre-measures for denuclearization,"" the NIS was quoted as saying by Rep. Kim Min-ki of the ruling Democratic Party of Korea (DPK) who was briefed by the NIS during a closed-door National Assembly audit along with Rep. Lee Eun-jae of the main opposition Liberty Korea Party.  Upon U.S. Secretary of State Mike Pompeo's fourth visit to North Korea, North Korean leader Kim Jong-un agreed to allow international inspectors into the key nuclear testing site that the North has claimed it destroyed.  The NIS said the spy agency is taking a close look into the North's nuclear- and missile-related facilities such as the Yongbyon facility while saying it is considering various possibilities of the North's moves. But no major moves have been seen lately, the intelligence agency added.  In May, the North showed the moment the Punggye-ri nuclear test site was demolished before foreign journalists. The North has conducted all six of its nuclear tests at the site, including the latest in September 2017. "
North Korea issues stamps of historic Korean figures [PHOTOS] ,2018-10-31 14:57,North Korea,,"By Jung Da-minNorth Korea recently issued a set of stamps showing four historic Korean figures, the state-run Korean Central News Agency (KCNA) reported on Saturday.The Korean Stamp Corporation released the four stamps. They feature Yang Man-chun, a general of Goguryeo (37 B.C.-A.D. 668); Nam I, a general of the Joseon Dynasty (1392-1910); Choi Mu-soen, inventor of gunpowder and gunpowder weapons of the late Goryeo (918-1392) and early Joseon dynasties; and Baek Seon-haeng, a patriotic business woman known for her philanthropy during the Japanese colonial era (1910-1945).The four figures are well known in South Korea but the two Koreas differ in explaining historical details such as years or places. The KCNA report stated that Goguryeo was founded in 277 B.C. and Choi Mu-seon was born in 1326 while South Korea states it as 1325. While it is known in the South that Baek was born in Suwon, Gyeonggi Province, and later moved to Pyongyang, North Korean media did not mention her birthplace.  By Jung Da-min  North Korea recently issued a set of stamps showing four historic Korean figures, the state-run Korean Central News Agency (KCNA) reported on Saturday.  The Korean Stamp Corporation released the four stamps. They feature Yang Man-chun, a general of Goguryeo (37 B.C.-A.D. 668); Nam I, a general of the Joseon Dynasty (1392-1910); Choi Mu-soen, inventor of gunpowder and gunpowder weapons of the late Goryeo (918-1392) and early Joseon dynasties; and Baek Seon-haeng, a patriotic business woman known for her philanthropy during the Japanese colonial era (1910-1945).  The four figures are well known in South Korea but the two Koreas differ in explaining historical details such as years or places. The KCNA report stated that Goguryeo was founded in 277 B.C. and Choi Mu-seon was born in 1326 while South Korea states it as 1325. While it is known in the South that Baek was born in Suwon, Gyeonggi Province, and later moved to Pyongyang, North Korean media did not mention her birthplace. "
Kim Jong-un promotes Samjiyon as hub for potato production [PHOTOS] ,2018-10-31 14:51,North Korea,,"By Jung Da-minNorth Korea's leader Kim Jong-un has visited the Samjiyon Potato Farina Production Factory for the second time this year, after a visit in July, the state-run Korean Central News Agency (KCNA) reported Tuesday. During his inspection of the factory, in Samjiyon County, Ryanggang Province, bordering China, Kim praised the county for ""reaping a high yield in potato farming despite unusually unfavorable climatic conditions this year,"" KCNA reported. North Korea has been promoting the policy of ""bringing about a revolution in potato farming"" set by former leader Kim Jong-il in 1998. Commemorating the 20th anniversary of the policy, North Korea's party mouthpiece Rodong Sinmun on Oct. 1 highlighted Kim Jong-il and Kim Jong-un's focus on the drive ""to settle the food issue of the people.""Meanwhile, Kim also inspected a construction site in Samjiyon County, calling for early completion of the work by Oct. 2020, which marks the 75th anniversary of the Workers' Party of Korea. It was Kim's third inspection this year, following visits in July and August.  By Jung Da-min  North Korea's leader Kim Jong-un has visited the Samjiyon Potato Farina Production Factory for the second time this year, after a visit in July, the state-run Korean Central News Agency (KCNA) reported Tuesday.  During his inspection of the factory, in Samjiyon County, Ryanggang Province, bordering China, Kim praised the county for ""reaping a high yield in potato farming despite unusually unfavorable climatic conditions this year,"" KCNA reported.  North Korea has been promoting the policy of ""bringing about a revolution in potato farming"" set by former leader Kim Jong-il in 1998. Commemorating the 20th anniversary of the policy, North Korea's party mouthpiece Rodong Sinmun on Oct. 1 highlighted Kim Jong-il and Kim Jong-un's focus on the drive ""to settle the food issue of the people.""  Meanwhile, Kim also inspected a construction site in Samjiyon County, calling for early completion of the work by Oct. 2020, which marks the 75th anniversary of the Workers' Party of Korea. It was Kim's third inspection this year, following visits in July and August.    "
North Korea preparing for inspectors' visit to nuclear test site: spy agency ,2018-10-31 14:43,North Korea,,"North Korea is apparently preparing for a possible visit by outside inspectors to verify the shutdown of its nuclear test site in the northeast, Seoul's spy agency said Wednesday during a parliamentary audit.After his fourth visit to North Korea in October, U.S. Secretary of State Mike Pompeo said that North Korean leader Kim Jong-un had promised to let foreign inspectors visit the Punggye-ri site as soon as logistics-related details are worked out.In May, the North demolished its nuclear test site before foreign journalists but without the presence of outside experts. The North has conducted all six of its nuclear tests there, including the latest in September 2017.At the closed-door audit session, the National Intelligence Service (NIS) briefed lawmakers that it is closely monitoring the North's movement.  North Korea is apparently preparing for a possible visit by outside inspectors to verify the shutdown of its nuclear test site in the northeast, Seoul's spy agency said Wednesday during a parliamentary audit.  After his fourth visit to North Korea in October, U.S. Secretary of State Mike Pompeo said that North Korean leader Kim Jong-un had promised to let foreign inspectors visit the Punggye-ri site as soon as logistics-related details are worked out.  In May, the North demolished its nuclear test site before foreign journalists but without the presence of outside experts. The North has conducted all six of its nuclear tests there, including the latest in September 2017.  At the closed-door audit session, the National Intelligence Service (NIS) briefed lawmakers that it is closely monitoring the North's movement.  ""Signs have been detected that North Korea is doing some preparations and intelligence-related activity over a possible visit by outside experts, as it shut down the nuclear test site and demolished some of the missile launching facilities at Dongchang-ri,"" the NIS was quoted as saying by Rep. Kim Min-ki of the ruling party.The North's leader agreed to permanently shut down its Dongchang-ri missile engine testing facility and missile launch pad under the participation of outside experts during his Pyongyang summit with President Moon Jae-in in September.The lawmaker said that the spy agency is closely monitoring North Korea's nuclear and missile facilities, including the Yongbyon nuclear complex, and no big changes have been detected.The NIS also said that North Korea has continued to engage in hacking attacks to steal information and money, breaking into email accounts and mining virtual currency to earn foreign currency. (Yonhap)  ""Signs have been detected that North Korea is doing some preparations and intelligence-related activity over a possible visit by outside experts, as it shut down the nuclear test site and demolished some of the missile launching facilities at Dongchang-ri,"" the NIS was quoted as saying by Rep. Kim Min-ki of the ruling party.  The North's leader agreed to permanently shut down its Dongchang-ri missile engine testing facility and missile launch pad under the participation of outside experts during his Pyongyang summit with President Moon Jae-in in September.  The lawmaker said that the spy agency is closely monitoring North Korea's nuclear and missile facilities, including the Yongbyon nuclear complex, and no big changes have been detected.  The NIS also said that North Korea has continued to engage in hacking attacks to steal information and money, breaking into email accounts and mining virtual currency to earn foreign currency. (Yonhap) "
"South Korea, US to launch working group on North Korea ",2018-10-31 14:24,North Korea,,"South Korea and the United States have agreed to launch a working group to improve coordination on their joint approach to North Korea, the U.S. State Department said Tuesday.The agreement was reached during a trip to Seoul this week by U.S. Special Representative for North Korea Stephen Biegun, according to the department's deputy spokesperson, Robert Palladino.The announcement comes amid a perceived rift in the allies' approach to North Korea. Seoul has been pushing cross-border projects with the North in a bid to spur the denuclearization of the regime, but Washington has appeared concerned about the possible undermining of sanctions on Pyongyang.The purpose of Biegun's visit to Seoul was to discuss diplomatic efforts to achieve the ""final, fully verified"" denuclearization of North Korea, Palladino said.""As part of that, the two governments agreed on establishing a new working group that would further strengthen our close coordination on our diplomacy, on our denuclearization efforts, on sanctions implementation and inter-Korean cooperation that comply with United Nations sanctions,"" the spokesperson said during a press briefing.""So this is an additional step that we're taking that Special Representative Biegun and his team will be leading,"" he added, declining to provide details on who will make up the two sides of the working group.In Seoul, presidential spokesman Kim Eui-kyeom said that the working group is aimed at conducting closer discussions between Seoul and Washington about denuclearization and the peace process on the Korean Peninsula.The U.S. proposed the working group's establishment as part of efforts to conduct discussions in a more systematic manner since Biegun took over as chief nuclear envoy, and the South agreed to the proposal, the spokesman said.Kim said, however, that details of the working group have yet to be determined.The two Koreas have held three summits this year with a focus on reducing tensions between the sides and laying the groundwork for denuclearization negotiations between Washington and Pyongyang.U.S. President Donald Trump and North Korean leader Kim Jong-un met in Singapore in June in the first-ever summit between the nations. They came away with an agreement to work toward ""complete"" denuclearization of the Korean Peninsula in exchange for security guarantees from the U.S., but progress on the deal has appeared slow.Trump and Kim are expected to hold a second summit early next year. (Yonhap)  South Korea and the United States have agreed to launch a working group to improve coordination on their joint approach to North Korea, the U.S. State Department said Tuesday.  The agreement was reached during a trip to Seoul this week by U.S. Special Representative for North Korea Stephen Biegun, according to the department's deputy spokesperson, Robert Palladino.  The announcement comes amid a perceived rift in the allies' approach to North Korea. Seoul has been pushing cross-border projects with the North in a bid to spur the denuclearization of the regime, but Washington has appeared concerned about the possible undermining of sanctions on Pyongyang.  The purpose of Biegun's visit to Seoul was to discuss diplomatic efforts to achieve the ""final, fully verified"" denuclearization of North Korea, Palladino said.  ""As part of that, the two governments agreed on establishing a new working group that would further strengthen our close coordination on our diplomacy, on our denuclearization efforts, on sanctions implementation and inter-Korean cooperation that comply with United Nations sanctions,"" the spokesperson said during a press briefing.  ""So this is an additional step that we're taking that Special Representative Biegun and his team will be leading,"" he added, declining to provide details on who will make up the two sides of the working group.  In Seoul, presidential spokesman Kim Eui-kyeom said that the working group is aimed at conducting closer discussions between Seoul and Washington about denuclearization and the peace process on the Korean Peninsula.  The U.S. proposed the working group's establishment as part of efforts to conduct discussions in a more systematic manner since Biegun took over as chief nuclear envoy, and the South agreed to the proposal, the spokesman said.  Kim said, however, that details of the working group have yet to be determined.  The two Koreas have held three summits this year with a focus on reducing tensions between the sides and laying the groundwork for denuclearization negotiations between Washington and Pyongyang.  U.S. President Donald Trump and North Korean leader Kim Jong-un met in Singapore in June in the first-ever summit between the nations. They came away with an agreement to work toward ""complete"" denuclearization of the Korean Peninsula in exchange for security guarantees from the U.S., but progress on the deal has appeared slow.  Trump and Kim are expected to hold a second summit early next year. (Yonhap) "
