제목,날짜,분류,기자,본문
US position on North Korean sanctions unchanged as Koreas push railway project ,2018-10-25 10:25,North Korea,,"The United States has not changed its position that sanctions on North Korea must remain in full force despite the two Koreas' push to reconnect railways and roads across their border, a U.S. government spokesperson said Wednesday.South Korea and North Korea plan to hold a groundbreaking ceremony between late November and early December to reconnect and modernize railways and roads along their eastern and western coasts.The move comes amid rapid rapprochement between the Koreas, sparking concern in the U.S. that the delivery of supplies to the North could undermine sanctions placed on the regime for its nuclear weapons and ballistic missile programs.""Our position has not changed,"" Katina Adams, the spokesperson for the U.S. State Department, said in response to a Yonhap query. ""The United States and our allies the Republic of Korea and Japan are committed to close coordination on our unified response to North Korea. We expect all member states to fully implement U.N. sanctions, including sectoral goods banned under U.N. Security Council resolutions, and expect all nations to take their responsibilities seriously to help end the DPRK's illegal nuclear and missile programs.""DPRK stands for North Korea's official name, the Democratic People's Republic of Korea.Seoul and Washington are in talks to clear any hurdles ahead of the ceremony.Speaking to reporters in Washington on Tuesday, a senior South Korean government official said the talks are ""going well"" and that he expects ""good news."" (Yonhap)  The United States has not changed its position that sanctions on North Korea must remain in full force despite the two Koreas' push to reconnect railways and roads across their border, a U.S. government spokesperson said Wednesday.  South Korea and North Korea plan to hold a groundbreaking ceremony between late November and early December to reconnect and modernize railways and roads along their eastern and western coasts.  The move comes amid rapid rapprochement between the Koreas, sparking concern in the U.S. that the delivery of supplies to the North could undermine sanctions placed on the regime for its nuclear weapons and ballistic missile programs.  ""Our position has not changed,"" Katina Adams, the spokesperson for the U.S. State Department, said in response to a Yonhap query. ""The United States and our allies the Republic of Korea and Japan are committed to close coordination on our unified response to North Korea. We expect all member states to fully implement U.N. sanctions, including sectoral goods banned under U.N. Security Council resolutions, and expect all nations to take their responsibilities seriously to help end the DPRK's illegal nuclear and missile programs.""  DPRK stands for North Korea's official name, the Democratic People's Republic of Korea.  Seoul and Washington are in talks to clear any hurdles ahead of the ceremony.  Speaking to reporters in Washington on Tuesday, a senior South Korean government official said the talks are ""going well"" and that he expects ""good news."" (Yonhap) "
Businesspeople to visit Gaeseong next week ,2018-10-24 17:39,North Korea,,"By Kim Bo-eunA group of businesspeople who had operations at the now-stalled inter-Korean industrial complex in the North Korean border city of Gaeseong will visit there next week.They will inspect production facilities there, South Korean officials said Wednesday. However, speculation is rampant that their visit is a step toward reopening the complex.The issue could create a rift between Seoul and Washington, which have been reportedly at odds over maintaining sanctions against Pyongyang. The U.S. has insisted reopening the complex would violate international sanctions.The visit will be the first since South Korea shut down the complex in February 2016, due to the North's missile and nuclear provocations. Since then, the businesspeople have filed six requests for visits, including three this year _ the unification ministry has turned all of them down.The ministry's approval this time is seen as reflecting the current circumstances in which economic cooperation with the North has seemingly become more viable. The ministry, however, said the visit was not related to resuming operations at the Gaeseong Industrial Complex (GIC).""The plan for the businesspeople to visit the GIC has nothing to do with the resumption of its operation,"" said Unification Ministry spokesman Baik Tae-hyun.""The ministry considered that the South Korean businesspeople had made repeated requests to visit, and that the planned one is to inspect assets in order to protect their property rights.""Still, the visit is seen as a positive sign for prospective resumption of the GIC's operation.The spokesman referred to Unification Minister Cho Myoung-gyon's remarks at a National Assembly audit held earlier this month to explain why the ministry was only now approving their visit.To lawmakers' questions, Cho said the Koreas were discussing the issue of the visit to the GIC. The owners of businesses active at the inter-Korean industrial complex have been suffering losses due to the shutdown.The spokesman also referred to the Pyongyang Declaration that was reached at the third inter-Korean summit last month. The declaration states that the Koreas will seek to resume the operation of the GIC as well as tours to Mount Geumgang in the North ""when conditions are met.""With an agreement reached between the Koreas this week to modernize 10 tree nurseries in the North within the year, and hold a groundbreaking ceremony to connect railways of the South and North in November or December, views are that the prospects for inter-Korean economic cooperation appear bright.However, the planned visit is set to take place amid growing U.S. concerns on moving forward with inter-Korean economic cooperation amid a lack of progress on North Korea's denuclearization.  By Kim Bo-eun  A group of businesspeople who had operations at the now-stalled inter-Korean industrial complex in the North Korean border city of Gaeseong will visit there next week.  They will inspect production facilities there, South Korean officials said Wednesday. However, speculation is rampant that their visit is a step toward reopening the complex.  The issue could create a rift between Seoul and Washington, which have been reportedly at odds over maintaining sanctions against Pyongyang. The U.S. has insisted reopening the complex would violate international sanctions.  The visit will be the first since South Korea shut down the complex in February 2016, due to the North's missile and nuclear provocations. Since then, the businesspeople have filed six requests for visits, including three this year _ the unification ministry has turned all of them down.  The ministry's approval this time is seen as reflecting the current circumstances in which economic cooperation with the North has seemingly become more viable. The ministry, however, said the visit was not related to resuming operations at the Gaeseong Industrial Complex (GIC).  ""The plan for the businesspeople to visit the GIC has nothing to do with the resumption of its operation,"" said Unification Ministry spokesman Baik Tae-hyun.  ""The ministry considered that the South Korean businesspeople had made repeated requests to visit, and that the planned one is to inspect assets in order to protect their property rights.""  Still, the visit is seen as a positive sign for prospective resumption of the GIC's operation.  The spokesman referred to Unification Minister Cho Myoung-gyon's remarks at a National Assembly audit held earlier this month to explain why the ministry was only now approving their visit.  To lawmakers' questions, Cho said the Koreas were discussing the issue of the visit to the GIC. The owners of businesses active at the inter-Korean industrial complex have been suffering losses due to the shutdown.  The spokesman also referred to the Pyongyang Declaration that was reached at the third inter-Korean summit last month. The declaration states that the Koreas will seek to resume the operation of the GIC as well as tours to Mount Geumgang in the North ""when conditions are met.""  With an agreement reached between the Koreas this week to modernize 10 tree nurseries in the North within the year, and hold a groundbreaking ceremony to connect railways of the South and North in November or December, views are that the prospects for inter-Korean economic cooperation appear bright.  However, the planned visit is set to take place amid growing U.S. concerns on moving forward with inter-Korean economic cooperation amid a lack of progress on North Korea's denuclearization.   "
'North Korea ready to expand internet access' ,2018-10-24 17:28,North Korea,,"By Jung Da-minNorth Korea is a country where residents do not have free access to the internet, but the country's science-priority policies are leading to an expansion in the number of new users.On Aug. 31, the Korean Society for Internet Information (KSII), a South Korean institute focusing on information technology, published a paper written by five North Korean scholars, titled ""Improved Hybrid Symbiotic Organism Search Task-Scheduling Algorithm for Cloud Computing,"" on its website.This was the first time that a paper by North Korean scholars was published in a South Korean journal. The paper deals with how to speed up the processing of file storage in an internet-connected computer cloud through the latest artificial intelligence techniques.The academy told KBS that they received the article from the North through email, and North Korean scholars expressed their hope for joint inter-Korean research projects in the field of information technology (IT).Park Chan-mo, chancellor of Pyongyang University of Science and Technology (PUST), said this was evidence of a change in North Korea's policy toward promoting the country's science and IT technology.According to Park, although PUST is the only university in North Korea known for its internet access, other top universities there might also be allowing students to use it.""This year, Kim Chaek University of Technology launched its website in August, commemorating the 70th anniversary of its foundation,"" Park said, during a seminar on North Korea's information and communications technology (ICT) held Tuesday at the National Assembly. ""Kim Il Sung University started to run their own website about three to four years ago.""At the seminar hosted by Seoul National University of Science and Technology's Graduate school of Public Policy and Information Technology, Park said North Korea seemed to be expanding internet access to more students, citing the talks he had with officials at Kim Il Sung University.""They told me they were soon going to allow their students to access the internet, when I asked them three years ago,"" Park said.As a Korean-American professor, he traveled in North Korea for 17 years before a U.S. travel ban took effect last year. Since 2011, he has served as chancellor of PUST, the first inter-Korean joint private university established in 2010.""North Korea's software technology has reached a level comparable to that of developed countries and this has been proven at many international software and coding competitions,"" he noted.Among the North's award-winning programs is an artificial intelligence Go (known as Baduk in Korean) program ""Eunbyul,"" developed in 1997 by five technicians from the Korean Computer Center (KCC). The program won first prize at the Computer Go World Championships held by Japan's Foundation of Fusion of Science and Technology (FOST) in 1998 and from 2003 to 2006, consecutively.""If inter-Korean exchanges take place in the field of ICT, the hardware of South Korea and the software technology of North Korea will have great synergy,"" Park said. ""International sanctions on the regime and the overall gap between the two Koreas in levels of information communication technologies, however, would be hurdles in inter-Korean ICT exchanges."" "
Two Koreas to create joint military committee ,2018-10-24 17:07,North Korea,,"By Lee Min-hyungSouth Korea will propose to North Korea that the envisioned inter-Korean military committee be headed by vice minister-level officials from both sides in an effort to prevent possible border conflicts.In September, the two Koreas agreed to launch a joint military committee to fulfill a series of inter-Korean military agreements signed during a summit in Pyongyang between President Moon Jae-in and North Korean leader Kim Jong-un.Details of the launch of the committee are expected to be discussed during the planned inter-Korean general-level military dialogue on Friday.According to the defense ministry here, Seoul plans to propose Vice Defense Minister Suh Choo-suk as the head of the committee on its side, and expects the North's Army General So Hong-chan, first vice minister of the regime's People's Armed Forces, to lead the northern side of the committee.The Ministry of National Defense said details will be refined during the upcoming military dialogue.On Wednesday, Suh attended a two-day defense forum in Beijing, and discussed the security situation on the Korean Peninsula. In particular, keen attention has been drawn over whether Suh can meet with a North Korean delegation led by another vice defense minister of the regime, Kim Hyong-ryong.""No schedules have been arranged for the vice ministerial meeting from the two Koreas during the forum, but Suh and his northern counterpart can meet immediately,"" South Korea's defense ministry spokeswoman Choi Hyun-soo said.Suh plans to meet with military delegations from 67 countries, and ask for continued support for the ongoing peace momentum. He is also expected to urge international society to support North Korea's pledge for denuclearization.Expectations are that the two Koreas can speed up fulfilling their joint military agreement after establishing the inter-Korean military committee.After Seoul and Pyongyang signed a comprehensive military agreement last month, both sides are increasing their military exchanges. Last week, South and North Korea finished their 20-day-long mine removal activity in the inter-Korea border village of Panmunjeom. The United Nations Command (UNC) also verified the inter-Korean mine removal.The UNC said it would continue supporting the inter-Korean military tension-easing measures by helping them fulfill other joint military agreements, such as the pullout of troops and firearms from guard posts at the Joint Security Area (JSA).The inter-Korean military committee, after its establishment, will likely discuss detailed timelines and measures to realize the comprehensive military agreement. By Lee Min-hyung  South Korea will propose to North Korea that the envisioned inter-Korean military committee be headed by vice minister-level officials from both sides in an effort to prevent possible border conflicts.  In September, the two Koreas agreed to launch a joint military committee to fulfill a series of inter-Korean military agreements signed during a summit in Pyongyang between President Moon Jae-in and North Korean leader Kim Jong-un.  Details of the launch of the committee are expected to be discussed during the planned inter-Korean general-level military dialogue on Friday.  According to the defense ministry here, Seoul plans to propose Vice Defense Minister Suh Choo-suk as the head of the committee on its side, and expects the North's Army General So Hong-chan, first vice minister of the regime's People's Armed Forces, to lead the northern side of the committee.  The Ministry of National Defense said details will be refined during the upcoming military dialogue.  On Wednesday, Suh attended a two-day defense forum in Beijing, and discussed the security situation on the Korean Peninsula. In particular, keen attention has been drawn over whether Suh can meet with a North Korean delegation led by another vice defense minister of the regime, Kim Hyong-ryong.  ""No schedules have been arranged for the vice ministerial meeting from the two Koreas during the forum, but Suh and his northern counterpart can meet immediately,"" South Korea's defense ministry spokeswoman Choi Hyun-soo said.  Suh plans to meet with military delegations from 67 countries, and ask for continued support for the ongoing peace momentum. He is also expected to urge international society to support North Korea's pledge for denuclearization.  Expectations are that the two Koreas can speed up fulfilling their joint military agreement after establishing the inter-Korean military committee.  After Seoul and Pyongyang signed a comprehensive military agreement last month, both sides are increasing their military exchanges. Last week, South and North Korea finished their 20-day-long mine removal activity in the inter-Korea border village of Panmunjeom. The United Nations Command (UNC) also verified the inter-Korean mine removal.  The UNC said it would continue supporting the inter-Korean military tension-easing measures by helping them fulfill other joint military agreements, such as the pullout of troops and firearms from guard posts at the Joint Security Area (JSA).  The inter-Korean military committee, after its establishment, will likely discuss detailed timelines and measures to realize the comprehensive military agreement.  "
Seoul cancels own military training ,2018-10-24 17:07,North Korea,,"By Lee Min-hyungSeoul is on track to reduce or cancel planned military drills in line with the ongoing inter-Korean tension-easing despite concerns the move may weaken defense readiness here.Last week, the Pentagon said Washington and Seoul will suspend their upcoming joint air defense exercise, Vigilant Ace, scheduled to take place in December, as part of a bargaining chip for North Korea to speed up its denuclearization.The decision came amid the rare peace gesture from Pyongyang which has in recent months urged Seoul and Washington to stop their joint annual drills. The regime has viewed such joint drills as a potential security threat, calling it the biggest stumbling block to prevent inter-Korean reconciliation.Aside from the Seoul-Washington joint drills, South Korea has also decided to cancel its own military training. The biannual drill, taking place on the South's East Sea area, was supposed to take place next month, but the military decided to cancel it following an inter-Korean military agreement last month.Under the agreement, South Korea set a buffer zone spanning 80 kilometers in the East Sea, as part of efforts to alleviate maritime military tension with North Korea.""Starting from Nov. 1, South Korea cannot conduct a planned exercise there due to the military agreement,"" a government official said, asking for anonymity. ""The Army, however, plans to hold an artillery drill by shifting the venue in a bid to maintain combat readiness.""The Army and the Navy have joined forces to conduct the drill each year in April and November with a view to keeping a solid defense posture in the face of possible military provocations from North Korea.The decision is not the first of its kind, as the South Korean government is in a position to stop provoking the North to extend the dialogue momentum and keep the regime on the dialogue table.In June this year, Seoul and Washington decided to suspend their joint large-scale Ulchi Freedom Guardian (UFG) exercise scheduled to kick off in August. Seoul and Washington have reached a consensus over the suspension in return for North Korea's pledge to realize what it calls the complete denuclearization of the Korean Peninsula.North Korean leader Kim Jong-un has called for his southern counterpart President Moon Jae-in to take corresponding ""peace-building"" measures during their summit talks which were held three times this year.In a recent European tour, President Moon also asked for international society to ease tough sanctions imposed on the North, so that Kim Jong-un can continue taking steps for peace on the peninsula. By Lee Min-hyung  Seoul is on track to reduce or cancel planned military drills in line with the ongoing inter-Korean tension-easing despite concerns the move may weaken defense readiness here.  Last week, the Pentagon said Washington and Seoul will suspend their upcoming joint air defense exercise, Vigilant Ace, scheduled to take place in December, as part of a bargaining chip for North Korea to speed up its denuclearization.  The decision came amid the rare peace gesture from Pyongyang which has in recent months urged Seoul and Washington to stop their joint annual drills. The regime has viewed such joint drills as a potential security threat, calling it the biggest stumbling block to prevent inter-Korean reconciliation.  Aside from the Seoul-Washington joint drills, South Korea has also decided to cancel its own military training. The biannual drill, taking place on the South's East Sea area, was supposed to take place next month, but the military decided to cancel it following an inter-Korean military agreement last month.  Under the agreement, South Korea set a buffer zone spanning 80 kilometers in the East Sea, as part of efforts to alleviate maritime military tension with North Korea.  ""Starting from Nov. 1, South Korea cannot conduct a planned exercise there due to the military agreement,"" a government official said, asking for anonymity. ""The Army, however, plans to hold an artillery drill by shifting the venue in a bid to maintain combat readiness.""  The Army and the Navy have joined forces to conduct the drill each year in April and November with a view to keeping a solid defense posture in the face of possible military provocations from North Korea.  The decision is not the first of its kind, as the South Korean government is in a position to stop provoking the North to extend the dialogue momentum and keep the regime on the dialogue table.  In June this year, Seoul and Washington decided to suspend their joint large-scale Ulchi Freedom Guardian (UFG) exercise scheduled to kick off in August. Seoul and Washington have reached a consensus over the suspension in return for North Korea's pledge to realize what it calls the complete denuclearization of the Korean Peninsula.  North Korean leader Kim Jong-un has called for his southern counterpart President Moon Jae-in to take corresponding ""peace-building"" measures during their summit talks which were held three times this year.  In a recent European tour, President Moon also asked for international society to ease tough sanctions imposed on the North, so that Kim Jong-un can continue taking steps for peace on the peninsula. "
South Korean business people to visit now-suspended factory park in North Korea: official ,2018-10-24 11:34,North Korea,,"South Korean business people who ran factories in the Kaesong Industrial Complex are pushing to visit the now-suspended industrial park in the North Korean border town next week at the earliest, a government official said Wednesday. Baek Tae-hyun, a spokesman of the Ministry of Unification, said that the Seoul government is discussing with North Korea details of the South Korean business owners' visit to Kaesong. ""The business owners need to visit the Kaesong Industrial Complex to protect their property rights and inspect their assets. Discussions with the North are still underway, and the schedule has yet to be fixed,"" Baek said in a media briefing. In this regard, ministry officials said about 150 business people are expected to make single-day trips to Kaesong in small groups for three days starting Oct. 31. Baek then stressed that the business owners' planned visit to Kaesong is only aimed at protecting their property rights and has nothing to do with the resumption of the industrial park. He explained that the Kaesong visit has been pushed in accordance with an inter-Korean summit agreement signed in Pyongyang last month. Minister of Unification Cho Myoung-gyon also told the National Assembly early this month that the government was discussing the South Korean business people's visit to Kaesong separately from the reopening of the North's industrial park. The government of former President Park Geun-hye abruptly announced the closure of the Kaesong park on Feb. 10, 2016, in retaliation for the North's fourth nuclear weapons test and long-range missile launch. Since then, the South Korean owners of Kaesong factories have never set foot in the North Korean industrial complex, though they have applied for a visit to the North's border town six times. President Moon Jae-in and North Korean leader Kim Jong-un agreed in their September summit to normalize the Kaesong Industrial Park and South Koreans' tour of the North's Mount Kumgang as soon as conditions are met. Meanwhile, the Committee for Emergency Measures for Kaesong Industrial Complex has begun relevant preparations for the Kaesong visit. A committee official said the number of Kaesong visitors is expected to reach 150 people, including representatives of 123 firms that ran factories in Kaesong and 30 support facilities, such as convenience stores and restaurants. The official said the visitors will likely be divided into six teams, each of which will be around 26 people, and one each will go to the Kaesong park in the morning and the afternoon for three days. (Yonhap) "
