제목,날짜,분류,기자,본문
Koreas consider forming joint wrestling team at Tokyo Olympics ,2018-10-20 19:21,North Korea,,"South and North Korea are considering forming a joint wrestling team at the 2020 Tokyo Olympic Games, Seoul's wrestling governing body said Saturday. Korea Wrestling Federation (KWF) said its competition director, Lee Joong-sub, and the North Korean wrestling body secretary general, Kim Il, met Thursday in Budapest, where the 2018 World Wrestling Championships is being held, and exchanged opinions on forming a joint wrestling team at the 2020 Olympics. ""Although it's not confirmed that we're going to have a joint team, both sides have exchanged their ideas in a good atmosphere,"" a KWF offical said. ""The two Koreas also touched on holding joint training in Seoul and Pyongyang."" According to the KWF, United World Wrestling President Nenad Lalovic also promised his support for the joint Korean team at the Olympics. The two Koreas previously trained together during the 18th Asian Games in Indonesia this summer, but didn't compete as one team. Expectations are high for the South and the North to have many joint teams at the next Olympics. Following the third inter-Korean summit in Pyongyang in September, the two Koreas announced in their joint declaration that they will seek ways to compete together in international sports competitions. The KWF said it will have further discussions with North Korea on forming the joint wrestling team. ""South Korea is better in Greco-Roman wrestling than North Korea, but North Korea is stronger in freestyle wrestling,"" a KWF official said. ""We believe that forming joint teams will help both sides upgrade their competitiveness."" But unlike other sports in which the two Koreas have had joint teams, wrestling doesn't have a team competition, meaning the officials will have a hard time dealing with Olympic quota issues and other entry problems. ""Since the UWW President vowed support, we expect to have a positive result,"" the KWF official said. (Yonhap)  South and North Korea are considering forming a joint wrestling team at the 2020 Tokyo Olympic Games, Seoul's wrestling governing body said Saturday.  Korea Wrestling Federation (KWF) said its competition director, Lee Joong-sub, and the North Korean wrestling body secretary general, Kim Il, met Thursday in Budapest, where the 2018 World Wrestling Championships is being held, and exchanged opinions on forming a joint wrestling team at the 2020 Olympics.  ""Although it's not confirmed that we're going to have a joint team, both sides have exchanged their ideas in a good atmosphere,"" a KWF offical said. ""The two Koreas also touched on holding joint training in Seoul and Pyongyang.""  According to the KWF, United World Wrestling President Nenad Lalovic also promised his support for the joint Korean team at the Olympics.  The two Koreas previously trained together during the 18th Asian Games in Indonesia this summer, but didn't compete as one team.  Expectations are high for the South and the North to have many joint teams at the next Olympics. Following the third inter-Korean summit in Pyongyang in September, the two Koreas announced in their joint declaration that they will seek ways to compete together in international sports competitions.  The KWF said it will have further discussions with North Korea on forming the joint wrestling team.  ""South Korea is better in Greco-Roman wrestling than North Korea, but North Korea is stronger in freestyle wrestling,"" a KWF official said. ""We believe that forming joint teams will help both sides upgrade their competitiveness.""  But unlike other sports in which the two Koreas have had joint teams, wrestling doesn't have a team competition, meaning the officials will have a hard time dealing with Olympic quota issues and other entry problems.  ""Since the UWW President vowed support, we expect to have a positive result,"" the KWF official said. (Yonhap) "
Pompeo hopes to meet North Koreans soon to discuss next summit ,2018-10-20 12:07,North Korea,,"U.S. Secretary of State Mike Pompeo said Friday that he hopes to meet with his North Korean counterpart ""in the next week and a half or so"" to continue planning for a second nuclear summit between their leaders. Pompeo revealed the plan during an interview held with the Voice of America on the sidelines of a trip to Mexico City. He said the date for a second meeting between U.S. President Donald Trump and North Korean leader Kim Jong-un has yet to be set. Asked if he expects it to happen ""in the very near future,"" he replied, ""I do."" ""We're working on finding dates and times and places that will work for each of the two leaders,"" Pompeo told the VOA. ""I'm very hopeful we'll have senior leader meetings here in the next week and a half or so between myself and my counterpart to continue this discussion so that when the two of them get together there is real opportunity to make another big step forward on denuclearization."" Pompeo was likely referring to North Korean Foreign Minister Ri Yong-ho, although he didn't specify. The top U.S. diplomat was in Pyongyang earlier this month to push progress on a denuclearization agreement reached by Trump and Kim at their first summit in Singapore in June. Part of the trip's aim was also to set up a second summit, which Trump has said will happen after the Nov. 6 U.S. midterm elections in one of three or four possible locations. ""Chairman Kim reiterated when I was with him ― now I guess it's two weeks ago ― his commitment to that, that he stands by the commitment he made to President Trump in Singapore on June 12th, and we intend to do everything we can to make sure that he delivers on that so that we can come to the day where the people of North Korea will indeed have a brighter future,"" Pompeo said. ""President Trump is determined to have North Korea achieve that."" In return for Kim's commitment to work toward ""complete"" denuclearization of the Korean Peninsula, Trump promised the U.S. would provide security guarantees to the regime. Pompeo said it's a ""very difficult challenge"" for the North Korean leader to agree to surrender a nuclear weapons program on which the regime has staked its survival. ""I'm very happy that he's made this decision, but to execute on that is complex and will take time,"" he said. ""And so long as we can continue to make progress and not have missiles being fired and nuclear tests being conducted, allowing them to perfect their program even further, then I think it's all to the good."" Meanwhile, a senior U.S. administration official was quoted as telling a group of reporters the summit is unlikely to take place this year. ""A meeting is likely sometime after the first of the year,"" Reuters quoted the official as saying. (Yonhap)  U.S. Secretary of State Mike Pompeo said Friday that he hopes to meet with his North Korean counterpart ""in the next week and a half or so"" to continue planning for a second nuclear summit between their leaders.  Pompeo revealed the plan during an interview held with the Voice of America on the sidelines of a trip to Mexico City.  He said the date for a second meeting between U.S. President Donald Trump and North Korean leader Kim Jong-un has yet to be set. Asked if he expects it to happen ""in the very near future,"" he replied, ""I do.""  ""We're working on finding dates and times and places that will work for each of the two leaders,"" Pompeo told the VOA. ""I'm very hopeful we'll have senior leader meetings here in the next week and a half or so between myself and my counterpart to continue this discussion so that when the two of them get together there is real opportunity to make another big step forward on denuclearization.""  Pompeo was likely referring to North Korean Foreign Minister Ri Yong-ho, although he didn't specify.  The top U.S. diplomat was in Pyongyang earlier this month to push progress on a denuclearization agreement reached by Trump and Kim at their first summit in Singapore in June.  Part of the trip's aim was also to set up a second summit, which Trump has said will happen after the Nov. 6 U.S. midterm elections in one of three or four possible locations.  ""Chairman Kim reiterated when I was with him ― now I guess it's two weeks ago ― his commitment to that, that he stands by the commitment he made to President Trump in Singapore on June 12th, and we intend to do everything we can to make sure that he delivers on that so that we can come to the day where the people of North Korea will indeed have a brighter future,"" Pompeo said. ""President Trump is determined to have North Korea achieve that.""  In return for Kim's commitment to work toward ""complete"" denuclearization of the Korean Peninsula, Trump promised the U.S. would provide security guarantees to the regime.  Pompeo said it's a ""very difficult challenge"" for the North Korean leader to agree to surrender a nuclear weapons program on which the regime has staked its survival.  ""I'm very happy that he's made this decision, but to execute on that is complex and will take time,"" he said. ""And so long as we can continue to make progress and not have missiles being fired and nuclear tests being conducted, allowing them to perfect their program even further, then I think it's all to the good.""  Meanwhile, a senior U.S. administration official was quoted as telling a group of reporters the summit is unlikely to take place this year.  ""A meeting is likely sometime after the first of the year,"" Reuters quoted the official as saying. (Yonhap) "
North Korea's birth rate remains below replacement level ,2018-10-19 19:50,North Korea,,"By Jung Da-minGlobal trends towards smaller families and low birth rates are also being seen in North Korea, according to the United Nations Population Fund's (UNFPA) ""State of World Population 2018"" report, released Wednesday.The report said the ""total fertility rate (TFR)"" in North Korea stood at 1.9 this year and remained below the replacement rate of 2.1, required to maintain a stable population in the country. The TFR is a statistical indicator of the average number of children born during the lifetime of a woman between the ages 15 and 49.The report also said 75 percent of North Korean women practice contraception by any method, with 71 percent using ""modern methods"" such as pills, condoms and intrauterine devices. The figures are similar to those in South Korea ― 78 percent and 70 percent, respectively.""North Korean women often use an intrauterine device (IUD), often called a loop, as a method of contraception that inserts a small ring of plastic or copper around the uterus,"" said Lee Hae-won, a doctor of family medicine at Seoul Medical Center. ""The low birth rate, however, is not directly linked to the high use of IUDs, as many North Korean women cannot afford to replace the device as often as required.""Despite the poor conditions for maintaining contraceptive devices, the high percentage of women practicing contraception indicates the trend of having fewer children in North Korea, according to Park Young-ja, a director at the Korea Institute for National Unification's (KINU) North Korean Research Division.Park says North Korea's accelerated urbanization and strengthened autonomy of women, who have been leading the country's market economy, are among the reasons.""The decline in the birth rate was first observed after the Arduous March in the 1990s with economic hardship, but things have been changed as more women have been leading the country's market economy development since then,"" Park said. ""North Korean women now want to have fewer babies and smaller families with growing enthusiasm for education, and the decline in the birth rate is particularly observed among well-educated women in urban areas.""Meanwhile, South Korea's TFR stood at 1.3 this year according to the UNFPA report, also remaining steady in recent years.As the birth rates in the two Koreas both fall below the replacement rate, experts say there could be a limit to economic development of the Korean peninsula, even after unification.Aging is also a problem in the two Koreas, with the population of 65 or older standing at 9 percent in North Korea and 14 percent in South Korea. A country is labeled as ""aging,"" if the population of 65 or older is over 7 percent of the total, while it is ""aged"" when it passes the 14 percent threshold, according to the United Nations' definition. By Jung Da-min Global trends towards smaller families and low birth rates are also being seen in North Korea, according to the United Nations Population Fund's (UNFPA) "" "" report, released Wednesday.  The report said the ""total fertility rate (TFR)"" in North Korea stood at 1.9 this year and remained below the replacement rate of 2.1, required to maintain a stable population in the country. The TFR is a statistical indicator of the average number of children born during the lifetime of a woman between the ages 15 and 49.  The report also said 75 percent of North Korean women practice contraception by any method, with 71 percent using ""modern methods"" such as pills, condoms and intrauterine devices. The figures are similar to those in South Korea ― 78 percent and 70 percent, respectively.  ""North Korean women often use an intrauterine device (IUD), often called a loop, as a method of contraception that inserts a small ring of plastic or copper around the uterus,"" said Lee Hae-won, a doctor of family medicine at Seoul Medical Center. ""The low birth rate, however, is not directly linked to the high use of IUDs, as many North Korean women cannot afford to replace the device as often as required.""  Despite the poor conditions for maintaining contraceptive devices, the high percentage of women practicing contraception indicates the trend of having fewer children in North Korea, according to Park Young-ja, a director at the Korea Institute for National Unification's (KINU) North Korean Research Division.  Park says North Korea's accelerated urbanization and strengthened autonomy of women, who have been leading the country's market economy, are among the reasons.  ""The decline in the birth rate was first observed after the Arduous March in the 1990s with economic hardship, but things have been changed as more women have been leading the country's market economy development since then,"" Park said. ""North Korean women now want to have fewer babies and smaller families with growing enthusiasm for education, and the decline in the birth rate is particularly observed among well-educated women in urban areas.""  Meanwhile, South Korea's TFR stood at 1.3 this year according to the UNFPA report, also remaining steady in recent years.  As the birth rates in the two Koreas both fall below the replacement rate, experts say there could be a limit to economic development of the Korean peninsula, even after unification.  Aging is also a problem in the two Koreas, with the population of 65 or older standing at 9 percent in North Korea and 14 percent in South Korea. A country is labeled as ""aging,"" if the population of 65 or older is over 7 percent of the total, while it is ""aged"" when it passes the 14 percent threshold, according to the United Nations' definition. "
Pope's possible visit to North Korea fuels peace momentum ,2018-10-19 16:52,North Korea,,"By Yi Whan-wooPresident Moon Jae-in's vision for peace on the Korean Peninsula is expected to gain further momentum after Pope Francis accepted a handwritten letter from North Korean leader Kim Jong-un inviting him to visit Pyongyang, according to analysts, Friday. The letter was presented to the pope by President Moon, ThursdayIf realized, this will be the first visit by a leader of the Catholic Church to the North Korea, and could speed up Pyongyang's efforts to be recognized as a ""normal state"" connected to the outside world. This is in line with Moon's vision, the analysts noted.""The pope has been a symbol of peace and reconciliation. Because of this, Pope Francis' possible North Korea trip is not only historical but can also reshape the global image of the internationally-isolated regime,"" said Park Won-gon, a professor of international relations at Handong Global University. ""This can eventually heighten global awareness toward denuclearization as well as Moon's determination to declare an end to the 1950-53 Korean War.""The professor pointed out that Pope Francis has been praised for helping normalize relations between countries or parties in conflict. Among them are the United States and Cuba, and the Colombian government and the FARC rebel group.Yang Moo-jin, a professor at the University of North Korean Studies, said the papal visit could help stop the suppression of underground churches and human rights violations by the reclusive regime, as well as assist it in reconciling with democratic countries.Human rights abuses, along with its nuclear program, have been the main reasons for international criticism of Pyongyang. The Kim regime has denied the abuse accusations.""Of course, the Vatican and Pyongyang will need to coordinate the agenda and other details, and whether human rights issues will be discussed,"" Yang said. ""But even so, such a visit will force Kim Jong-un to decide on whether to continue deceiving the world or to improve human rights in line with international norms.""Some analysts say a papal visit may influence the Donald Trump administration's North Korea policy.Washington has insisted on retaining sanctions on North Korea and has called for progress on inter-Korean relations to be in lockstep with progress on denuclearization. It has apparently been displeased with the Moon government as Seoul has been speeding up efforts for cross-border cooperation.""I don't think a papal visit will change the course of U.S. policy on North Korea. But it can at least influence Washington to think the policy over,"" a professor at the Korea National Diplomatic Academy said on condition of anonymity.Professor Park speculated a papal trip could speed up arrangements for a second summit between Kim and Trump.Pope Francis' acceptance of the invitation to visit North Korea was a surprise because the Vatican previously insisted that this would only be possible if Catholic priests were allowed in the country.The Kim regime has no Catholic priests, or a Catholic Bishops' Conference, another condition required by the Vatican for a papal visit. By Yi Whan-woo  President Moon Jae-in's vision for peace on the Korean Peninsula is expected to gain further momentum after Pope Francis accepted a handwritten letter from North Korean leader Kim Jong-un inviting him to visit Pyongyang, according to analysts, Friday.  The letter was presented to the pope by President Moon, Thursday  If realized, this will be the first visit by a leader of the Catholic Church to the North Korea, and could speed up Pyongyang's efforts to be recognized as a ""normal state"" connected to the outside world. This is in line with Moon's vision, the analysts noted.  ""The pope has been a symbol of peace and reconciliation. Because of this, Pope Francis' possible North Korea trip is not only historical but can also reshape the global image of the internationally-isolated regime,"" said Park Won-gon, a professor of international relations at Handong Global University. ""This can eventually heighten global awareness toward denuclearization as well as Moon's determination to declare an end to the 1950-53 Korean War.""  The professor pointed out that Pope Francis has been praised for helping normalize relations between countries or parties in conflict. Among them are the United States and Cuba, and the Colombian government and the FARC rebel group.  Yang Moo-jin, a professor at the University of North Korean Studies, said the papal visit could help stop the suppression of underground churches and human rights violations by the reclusive regime, as well as assist it in reconciling with democratic countries.  Human rights abuses, along with its nuclear program, have been the main reasons for international criticism of Pyongyang. The Kim regime has denied the abuse accusations.  ""Of course, the Vatican and Pyongyang will need to coordinate the agenda and other details, and whether human rights issues will be discussed,"" Yang said. ""But even so, such a visit will force Kim Jong-un to decide on whether to continue deceiving the world or to improve human rights in line with international norms.""  Some analysts say a papal visit may influence the Donald Trump administration's North Korea policy.  Washington has insisted on retaining sanctions on North Korea and has called for progress on inter-Korean relations to be in lockstep with progress on denuclearization.  It has apparently been displeased with the Moon government as Seoul has been speeding up efforts for cross-border cooperation.  ""I don't think a papal visit will change the course of U.S. policy on North Korea. But it can at least influence Washington to think the policy over,"" a professor at the Korea National Diplomatic Academy said on condition of anonymity.  Professor Park speculated a papal trip could speed up arrangements for a second summit between Kim and Trump.  Pope Francis' acceptance of the invitation to visit North Korea was a surprise because the Vatican previously insisted that this would only be possible if Catholic priests were allowed in the country.  The Kim regime has no Catholic priests, or a Catholic Bishops' Conference, another condition required by the Vatican for a papal visit. "
Russia supplied more oil to N. Korea than China: UN ,2018-10-18 18:06,North Korea,,"By Park Ji-wonRussia supplied 2,000 more tons of refined oil to North Korea than China this year, U.N. data showed Wednesday. It has provided 12,324 tons of refined oil to the North so far, while China has supplied 10,109 tons, according to the website of the U.N. Security Council's sanctions committeeRussia's refined oil supply to North Korea for August was 1,369 tons.According to the U.N. resolution 2397, the total supply, sale or transfer of all refined petroleum products by U.N. member states to the North should not exceed 500,000 barrels or about 60,000 tons, during a period of 12 months beginning this year, and for 12-month periods thereafter.Several countries including the U.S. and South Korea have pointed out that Pyongyang possibly received (refined) oil from ships registered in a third country. Such shipments aren't reported.U.S. Ambassador to the United Nations Nikki Haley accused Russia last month of violating sanction against North Korea by delivering the fuel through ship-to-ship transfers at sea.Russian U.N. Ambassador Vassily Nebenzia refuted the allegation.Haley said, ""the United States tracked at least 148 instances of oil tankers delivering refined petroleum products obtained through illegal ship-to-ship transfers. We estimate that at the least, North Korea has obtained over 800,000 barrels of refined petroleum products in the first eight months of this year. That's 160 percent of the 2018 annual cap of 500,000."" By Park Ji-won  Russia supplied 2,000 more tons of refined oil to North Korea than China this year, U.N. data showed Wednesday.  It has provided 12,324 tons of refined oil to the North so far, while China has supplied 10,109 tons, according to the website of the U.N. Security Council's sanctions committee  Russia's refined oil supply to North Korea for August was 1,369 tons.  According to the U.N. resolution 2397, the total supply, sale or transfer of all refined petroleum products by U.N. member states to the North should not exceed 500,000 barrels or about 60,000 tons, during a period of 12 months beginning this year, and for 12-month periods thereafter.  Several countries including the U.S. and South Korea have pointed out that Pyongyang possibly received (refined) oil from ships registered in a third country. Such shipments aren't reported.  U.S. Ambassador to the United Nations Nikki Haley accused Russia last month of violating sanction against North Korea by delivering the fuel through ship-to-ship transfers at sea.  Russian U.N. Ambassador Vassily Nebenzia refuted the allegation.  Haley said, ""the United States tracked at least 148 instances of oil tankers delivering refined petroleum products obtained through illegal ship-to-ship transfers. We estimate that at the least, North Korea has obtained over 800,000 barrels of refined petroleum products in the first eight months of this year. That's 160 percent of the 2018 annual cap of 500,000."" "
